No.     Time           Source                Destination           Protocol Length Info
      1 0.000000       192.168.1.254         192.168.1.2           TCP      94     45658 → 5001 [PSH, ACK] Seq=1 Ack=1 Win=63870 Len=40

Frame 1: 94 bytes on wire (752 bits), 94 bytes captured (752 bits)
Ethernet II, Src: 4e:4a:57:60:5c:cd (4e:4a:57:60:5c:cd), Dst: FANUCROBOTIC_3f:bd:f4 (00:e0:e4:3f:bd:f4)
Internet Protocol Version 4, Src: 192.168.1.254, Dst: 192.168.1.2
Transmission Control Protocol, Src Port: 45658, Dst Port: 5001, Seq: 1, Ack: 1, Len: 40
Data (40 bytes)

0000  a0 a0 a0 a0 00 01 21 01 00 1e 00 01 00 1c 00 02   ......!.........
0010  00 01 80 01 00 00 00 00 00 00 00 00 00 00 00 09   ................
0020  00 00 00 00 00 00 00 00                           ........
    Data: a0a0a0a000012101001e0001001c0002000180010000000000000000000000090000000000000000
    [Length: 40]

No.     Time           Source                Destination           Protocol Length Info
      3 0.006870       192.168.1.254         192.168.1.2           TCP      54     45658 → 5001 [ACK] Seq=41 Ack=30 Win=63870 Len=0

Frame 3: 54 bytes on wire (432 bits), 54 bytes captured (432 bits)
Ethernet II, Src: 4e:4a:57:60:5c:cd (4e:4a:57:60:5c:cd), Dst: FANUCROBOTIC_3f:bd:f4 (00:e0:e4:3f:bd:f4)
Internet Protocol Version 4, Src: 192.168.1.254, Dst: 192.168.1.2
Transmission Control Protocol, Src Port: 45658, Dst Port: 5001, Seq: 41, Ack: 30, Len: 0

No.     Time           Source                Destination           Protocol Length Info
      4 0.008664       192.168.1.254         192.168.1.2           TCP      94     45658 → 5001 [PSH, ACK] Seq=41 Ack=30 Win=63870 Len=40

Frame 4: 94 bytes on wire (752 bits), 94 bytes captured (752 bits)
Ethernet II, Src: 4e:4a:57:60:5c:cd (4e:4a:57:60:5c:cd), Dst: FANUCROBOTIC_3f:bd:f4 (00:e0:e4:3f:bd:f4)
Internet Protocol Version 4, Src: 192.168.1.254, Dst: 192.168.1.2
Transmission Control Protocol, Src Port: 45658, Dst Port: 5001, Seq: 41, Ack: 30, Len: 40
Data (40 bytes)

0000  a0 a0 a0 a0 00 01 21 01 00 1e 00 01 00 1c 00 01   ......!.........
0010  00 02 00 15 00 00 02 d0 00 00 02 d2 00 00 00 00   ................
0020  00 00 00 00 00 00 00 00                           ........
    Data: a0a0a0a000012101001e0001001c000100020015000002d0000002d2000000000000000000000000
    [Length: 40]

No.     Time           Source                Destination           Protocol Length Info
      6 0.030539       192.168.1.254         192.168.1.2           TCP      94     45658 → 5001 [PSH, ACK] Seq=81 Ack=82 Win=63870 Len=40

Frame 6: 94 bytes on wire (752 bits), 94 bytes captured (752 bits)
Ethernet II, Src: 4e:4a:57:60:5c:cd (4e:4a:57:60:5c:cd), Dst: FANUCROBOTIC_3f:bd:f4 (00:e0:e4:3f:bd:f4)
Internet Protocol Version 4, Src: 192.168.1.254, Dst: 192.168.1.2
Transmission Control Protocol, Src Port: 45658, Dst Port: 5001, Seq: 81, Ack: 82, Len: 40
Data (40 bytes)

0000  a0 a0 a0 a0 00 01 21 01 00 1e 00 01 00 1c 00 01   ......!.........
0010  00 01 00 15 00 00 02 d0 00 00 02 d2 00 00 00 00   ................
0020  00 00 00 00 00 00 00 00                           ........
    Data: a0a0a0a000012101001e0001001c000100010015000002d0000002d2000000000000000000000000
    [Length: 40]

No.     Time           Source                Destination           Protocol Length Info
      8 0.083993       192.168.1.254         192.168.1.2           TCP      54     45658 → 5001 [ACK] Seq=121 Ack=134 Win=63870 Len=0

Frame 8: 54 bytes on wire (432 bits), 54 bytes captured (432 bits)
Ethernet II, Src: 4e:4a:57:60:5c:cd (4e:4a:57:60:5c:cd), Dst: FANUCROBOTIC_3f:bd:f4 (00:e0:e4:3f:bd:f4)
Internet Protocol Version 4, Src: 192.168.1.254, Dst: 192.168.1.2
Transmission Control Protocol, Src Port: 45658, Dst Port: 5001, Seq: 121, Ack: 134, Len: 0

No.     Time           Source                Destination           Protocol Length Info
      9 0.106351       192.168.1.254         192.168.1.2           TCP      94     35796 → 5001 [PSH, ACK] Seq=1 Ack=1 Win=63870 Len=40

Frame 9: 94 bytes on wire (752 bits), 94 bytes captured (752 bits)
Ethernet II, Src: 4e:4a:57:60:5c:cd (4e:4a:57:60:5c:cd), Dst: FANUCROBOTIC_3f:bd:f4 (00:e0:e4:3f:bd:f4)
Internet Protocol Version 4, Src: 192.168.1.254, Dst: 192.168.1.2
Transmission Control Protocol, Src Port: 35796, Dst Port: 5001, Seq: 1, Ack: 1, Len: 40
Data (40 bytes)

0000  a0 a0 a0 a0 00 01 21 01 00 1e 00 01 00 1c 00 02   ......!.........
0010  00 01 80 01 00 00 00 00 00 00 00 00 00 00 00 09   ................
0020  00 00 00 00 00 00 00 00                           ........
    Data: a0a0a0a000012101001e0001001c0002000180010000000000000000000000090000000000000000
    [Length: 40]

No.     Time           Source                Destination           Protocol Length Info
     11 0.115603       192.168.1.254         192.168.1.2           TCP      54     35796 → 5001 [ACK] Seq=41 Ack=30 Win=63870 Len=0

Frame 11: 54 bytes on wire (432 bits), 54 bytes captured (432 bits)
Ethernet II, Src: 4e:4a:57:60:5c:cd (4e:4a:57:60:5c:cd), Dst: FANUCROBOTIC_3f:bd:f4 (00:e0:e4:3f:bd:f4)
Internet Protocol Version 4, Src: 192.168.1.254, Dst: 192.168.1.2
Transmission Control Protocol, Src Port: 35796, Dst Port: 5001, Seq: 41, Ack: 30, Len: 0

No.     Time           Source                Destination           Protocol Length Info
     12 0.116235       192.168.1.254         192.168.1.2           TCP      94     35796 → 5001 [PSH, ACK] Seq=41 Ack=30 Win=63870 Len=40

Frame 12: 94 bytes on wire (752 bits), 94 bytes captured (752 bits)
Ethernet II, Src: 4e:4a:57:60:5c:cd (4e:4a:57:60:5c:cd), Dst: FANUCROBOTIC_3f:bd:f4 (00:e0:e4:3f:bd:f4)
Internet Protocol Version 4, Src: 192.168.1.254, Dst: 192.168.1.2
Transmission Control Protocol, Src Port: 35796, Dst Port: 5001, Seq: 41, Ack: 30, Len: 40
Data (40 bytes)

0000  a0 a0 a0 a0 00 01 21 01 00 1e 00 01 00 1c 00 01   ......!.........
0010  00 02 00 15 00 00 02 d0 00 00 02 d2 00 00 00 00   ................
0020  00 00 00 00 00 00 00 00                           ........
    Data: a0a0a0a000012101001e0001001c000100020015000002d0000002d2000000000000000000000000
    [Length: 40]

No.     Time           Source                Destination           Protocol Length Info
     14 0.135923       192.168.1.254         192.168.1.2           TCP      94     35796 → 5001 [PSH, ACK] Seq=81 Ack=82 Win=63870 Len=40

Frame 14: 94 bytes on wire (752 bits), 94 bytes captured (752 bits)
Ethernet II, Src: 4e:4a:57:60:5c:cd (4e:4a:57:60:5c:cd), Dst: FANUCROBOTIC_3f:bd:f4 (00:e0:e4:3f:bd:f4)
Internet Protocol Version 4, Src: 192.168.1.254, Dst: 192.168.1.2
Transmission Control Protocol, Src Port: 35796, Dst Port: 5001, Seq: 81, Ack: 82, Len: 40
Data (40 bytes)

0000  a0 a0 a0 a0 00 01 21 01 00 1e 00 01 00 1c 00 01   ......!.........
0010  00 01 00 15 00 00 02 d0 00 00 02 d2 00 00 00 00   ................
0020  00 00 00 00 00 00 00 00                           ........
    Data: a0a0a0a000012101001e0001001c000100010015000002d0000002d2000000000000000000000000
    [Length: 40]

No.     Time           Source                Destination           Protocol Length Info
     16 0.192388       192.168.1.254         192.168.1.2           TCP      54     35796 → 5001 [ACK] Seq=121 Ack=134 Win=63870 Len=0

Frame 16: 54 bytes on wire (432 bits), 54 bytes captured (432 bits)
Ethernet II, Src: 4e:4a:57:60:5c:cd (4e:4a:57:60:5c:cd), Dst: FANUCROBOTIC_3f:bd:f4 (00:e0:e4:3f:bd:f4)
Internet Protocol Version 4, Src: 192.168.1.254, Dst: 192.168.1.2
Transmission Control Protocol, Src Port: 35796, Dst Port: 5001, Seq: 121, Ack: 134, Len: 0

No.     Time           Source                Destination           Protocol Length Info
     17 1.001057       192.168.1.254         192.168.1.2           TCP      94     45658 → 5001 [PSH, ACK] Seq=121 Ack=134 Win=63870 Len=40

Frame 17: 94 bytes on wire (752 bits), 94 bytes captured (752 bits)
Ethernet II, Src: 4e:4a:57:60:5c:cd (4e:4a:57:60:5c:cd), Dst: FANUCROBOTIC_3f:bd:f4 (00:e0:e4:3f:bd:f4)
Internet Protocol Version 4, Src: 192.168.1.254, Dst: 192.168.1.2
Transmission Control Protocol, Src Port: 45658, Dst Port: 5001, Seq: 121, Ack: 134, Len: 40
Data (40 bytes)

0000  a0 a0 a0 a0 00 01 21 01 00 1e 00 01 00 1c 00 02   ......!.........
0010  00 01 80 01 00 00 00 00 00 00 00 00 00 00 00 09   ................
0020  00 00 00 00 00 00 00 00                           ........
    Data: a0a0a0a000012101001e0001001c0002000180010000000000000000000000090000000000000000
    [Length: 40]

No.     Time           Source                Destination           Protocol Length Info
     19 1.011678       192.168.1.254         192.168.1.2           TCP      54     45658 → 5001 [ACK] Seq=161 Ack=163 Win=63870 Len=0

Frame 19: 54 bytes on wire (432 bits), 54 bytes captured (432 bits)
Ethernet II, Src: 4e:4a:57:60:5c:cd (4e:4a:57:60:5c:cd), Dst: FANUCROBOTIC_3f:bd:f4 (00:e0:e4:3f:bd:f4)
Internet Protocol Version 4, Src: 192.168.1.254, Dst: 192.168.1.2
Transmission Control Protocol, Src Port: 45658, Dst Port: 5001, Seq: 161, Ack: 163, Len: 0

No.     Time           Source                Destination           Protocol Length Info
     20 1.013295       192.168.1.254         192.168.1.2           TCP      94     45658 → 5001 [PSH, ACK] Seq=161 Ack=163 Win=63870 Len=40

Frame 20: 94 bytes on wire (752 bits), 94 bytes captured (752 bits)
Ethernet II, Src: 4e:4a:57:60:5c:cd (4e:4a:57:60:5c:cd), Dst: FANUCROBOTIC_3f:bd:f4 (00:e0:e4:3f:bd:f4)
Internet Protocol Version 4, Src: 192.168.1.254, Dst: 192.168.1.2
Transmission Control Protocol, Src Port: 45658, Dst Port: 5001, Seq: 161, Ack: 163, Len: 40
Data (40 bytes)

0000  a0 a0 a0 a0 00 01 21 01 00 1e 00 01 00 1c 00 01   ......!.........
0010  00 02 00 15 00 00 02 d0 00 00 02 d2 00 00 00 00   ................
0020  00 00 00 00 00 00 00 00                           ........
    Data: a0a0a0a000012101001e0001001c000100020015000002d0000002d2000000000000000000000000
    [Length: 40]

No.     Time           Source                Destination           Protocol Length Info
     22 1.033713       192.168.1.254         192.168.1.2           TCP      94     45658 → 5001 [PSH, ACK] Seq=201 Ack=215 Win=63870 Len=40

Frame 22: 94 bytes on wire (752 bits), 94 bytes captured (752 bits)
Ethernet II, Src: 4e:4a:57:60:5c:cd (4e:4a:57:60:5c:cd), Dst: FANUCROBOTIC_3f:bd:f4 (00:e0:e4:3f:bd:f4)
Internet Protocol Version 4, Src: 192.168.1.254, Dst: 192.168.1.2
Transmission Control Protocol, Src Port: 45658, Dst Port: 5001, Seq: 201, Ack: 215, Len: 40
Data (40 bytes)

0000  a0 a0 a0 a0 00 01 21 01 00 1e 00 01 00 1c 00 01   ......!.........
0010  00 01 00 15 00 00 02 d0 00 00 02 d2 00 00 00 00   ................
0020  00 00 00 00 00 00 00 00                           ........
    Data: a0a0a0a000012101001e0001001c000100010015000002d0000002d2000000000000000000000000
    [Length: 40]

No.     Time           Source                Destination           Protocol Length Info
     24 1.093051       192.168.1.254         192.168.1.2           TCP      54     45658 → 5001 [ACK] Seq=241 Ack=267 Win=63870 Len=0

Frame 24: 54 bytes on wire (432 bits), 54 bytes captured (432 bits)
Ethernet II, Src: 4e:4a:57:60:5c:cd (4e:4a:57:60:5c:cd), Dst: FANUCROBOTIC_3f:bd:f4 (00:e0:e4:3f:bd:f4)
Internet Protocol Version 4, Src: 192.168.1.254, Dst: 192.168.1.2
Transmission Control Protocol, Src Port: 45658, Dst Port: 5001, Seq: 241, Ack: 267, Len: 0

No.     Time           Source                Destination           Protocol Length Info
     25 1.106637       192.168.1.254         192.168.1.2           TCP      94     35796 → 5001 [PSH, ACK] Seq=121 Ack=134 Win=63870 Len=40

Frame 25: 94 bytes on wire (752 bits), 94 bytes captured (752 bits)
Ethernet II, Src: 4e:4a:57:60:5c:cd (4e:4a:57:60:5c:cd), Dst: FANUCROBOTIC_3f:bd:f4 (00:e0:e4:3f:bd:f4)
Internet Protocol Version 4, Src: 192.168.1.254, Dst: 192.168.1.2
Transmission Control Protocol, Src Port: 35796, Dst Port: 5001, Seq: 121, Ack: 134, Len: 40
Data (40 bytes)

0000  a0 a0 a0 a0 00 01 21 01 00 1e 00 01 00 1c 00 02   ......!.........
0010  00 01 80 01 00 00 00 00 00 00 00 00 00 00 00 09   ................
0020  00 00 00 00 00 00 00 00                           ........
    Data: a0a0a0a000012101001e0001001c0002000180010000000000000000000000090000000000000000
    [Length: 40]

No.     Time           Source                Destination           Protocol Length Info
     27 1.119501       192.168.1.254         192.168.1.2           TCP      54     35796 → 5001 [ACK] Seq=161 Ack=163 Win=63870 Len=0

Frame 27: 54 bytes on wire (432 bits), 54 bytes captured (432 bits)
Ethernet II, Src: 4e:4a:57:60:5c:cd (4e:4a:57:60:5c:cd), Dst: FANUCROBOTIC_3f:bd:f4 (00:e0:e4:3f:bd:f4)
Internet Protocol Version 4, Src: 192.168.1.254, Dst: 192.168.1.2
Transmission Control Protocol, Src Port: 35796, Dst Port: 5001, Seq: 161, Ack: 163, Len: 0

No.     Time           Source                Destination           Protocol Length Info
     28 1.120480       192.168.1.254         192.168.1.2           TCP      94     35796 → 5001 [PSH, ACK] Seq=161 Ack=163 Win=63870 Len=40

Frame 28: 94 bytes on wire (752 bits), 94 bytes captured (752 bits)
Ethernet II, Src: 4e:4a:57:60:5c:cd (4e:4a:57:60:5c:cd), Dst: FANUCROBOTIC_3f:bd:f4 (00:e0:e4:3f:bd:f4)
Internet Protocol Version 4, Src: 192.168.1.254, Dst: 192.168.1.2
Transmission Control Protocol, Src Port: 35796, Dst Port: 5001, Seq: 161, Ack: 163, Len: 40
Data (40 bytes)

0000  a0 a0 a0 a0 00 01 21 01 00 1e 00 01 00 1c 00 01   ......!.........
0010  00 02 00 15 00 00 02 d0 00 00 02 d2 00 00 00 00   ................
0020  00 00 00 00 00 00 00 00                           ........
    Data: a0a0a0a000012101001e0001001c000100020015000002d0000002d2000000000000000000000000
    [Length: 40]

No.     Time           Source                Destination           Protocol Length Info
     30 1.140732       192.168.1.254         192.168.1.2           TCP      94     35796 → 5001 [PSH, ACK] Seq=201 Ack=215 Win=63870 Len=40

Frame 30: 94 bytes on wire (752 bits), 94 bytes captured (752 bits)
Ethernet II, Src: 4e:4a:57:60:5c:cd (4e:4a:57:60:5c:cd), Dst: FANUCROBOTIC_3f:bd:f4 (00:e0:e4:3f:bd:f4)
Internet Protocol Version 4, Src: 192.168.1.254, Dst: 192.168.1.2
Transmission Control Protocol, Src Port: 35796, Dst Port: 5001, Seq: 201, Ack: 215, Len: 40
Data (40 bytes)

0000  a0 a0 a0 a0 00 01 21 01 00 1e 00 01 00 1c 00 01   ......!.........
0010  00 01 00 15 00 00 02 d0 00 00 02 d2 00 00 00 00   ................
0020  00 00 00 00 00 00 00 00                           ........
    Data: a0a0a0a000012101001e0001001c000100010015000002d0000002d2000000000000000000000000
    [Length: 40]

No.     Time           Source                Destination           Protocol Length Info
     32 1.224416       192.168.1.254         192.168.1.2           TCP      54     35796 → 5001 [ACK] Seq=241 Ack=267 Win=63870 Len=0

Frame 32: 54 bytes on wire (432 bits), 54 bytes captured (432 bits)
Ethernet II, Src: 4e:4a:57:60:5c:cd (4e:4a:57:60:5c:cd), Dst: FANUCROBOTIC_3f:bd:f4 (00:e0:e4:3f:bd:f4)
Internet Protocol Version 4, Src: 192.168.1.254, Dst: 192.168.1.2
Transmission Control Protocol, Src Port: 35796, Dst Port: 5001, Seq: 241, Ack: 267, Len: 0

No.     Time           Source                Destination           Protocol Length Info
     33 2.002782       192.168.1.254         192.168.1.2           TCP      94     45658 → 5001 [PSH, ACK] Seq=241 Ack=267 Win=63870 Len=40

Frame 33: 94 bytes on wire (752 bits), 94 bytes captured (752 bits)
Ethernet II, Src: 4e:4a:57:60:5c:cd (4e:4a:57:60:5c:cd), Dst: FANUCROBOTIC_3f:bd:f4 (00:e0:e4:3f:bd:f4)
Internet Protocol Version 4, Src: 192.168.1.254, Dst: 192.168.1.2
Transmission Control Protocol, Src Port: 45658, Dst Port: 5001, Seq: 241, Ack: 267, Len: 40
Data (40 bytes)

0000  a0 a0 a0 a0 00 01 21 01 00 1e 00 01 00 1c 00 02   ......!.........
0010  00 01 80 01 00 00 00 00 00 00 00 00 00 00 00 09   ................
0020  00 00 00 00 00 00 00 00                           ........
    Data: a0a0a0a000012101001e0001001c0002000180010000000000000000000000090000000000000000
    [Length: 40]

No.     Time           Source                Destination           Protocol Length Info
     35 2.015972       192.168.1.254         192.168.1.2           TCP      54     45658 → 5001 [ACK] Seq=281 Ack=296 Win=63870 Len=0

Frame 35: 54 bytes on wire (432 bits), 54 bytes captured (432 bits)
Ethernet II, Src: 4e:4a:57:60:5c:cd (4e:4a:57:60:5c:cd), Dst: FANUCROBOTIC_3f:bd:f4 (00:e0:e4:3f:bd:f4)
Internet Protocol Version 4, Src: 192.168.1.254, Dst: 192.168.1.2
Transmission Control Protocol, Src Port: 45658, Dst Port: 5001, Seq: 281, Ack: 296, Len: 0

No.     Time           Source                Destination           Protocol Length Info
     36 2.017594       192.168.1.254         192.168.1.2           TCP      94     45658 → 5001 [PSH, ACK] Seq=281 Ack=296 Win=63870 Len=40

Frame 36: 94 bytes on wire (752 bits), 94 bytes captured (752 bits)
Ethernet II, Src: 4e:4a:57:60:5c:cd (4e:4a:57:60:5c:cd), Dst: FANUCROBOTIC_3f:bd:f4 (00:e0:e4:3f:bd:f4)
Internet Protocol Version 4, Src: 192.168.1.254, Dst: 192.168.1.2
Transmission Control Protocol, Src Port: 45658, Dst Port: 5001, Seq: 281, Ack: 296, Len: 40
Data (40 bytes)

0000  a0 a0 a0 a0 00 01 21 01 00 1e 00 01 00 1c 00 01   ......!.........
0010  00 02 00 15 00 00 02 d0 00 00 02 d2 00 00 00 00   ................
0020  00 00 00 00 00 00 00 00                           ........
    Data: a0a0a0a000012101001e0001001c000100020015000002d0000002d2000000000000000000000000
    [Length: 40]

No.     Time           Source                Destination           Protocol Length Info
     38 2.041719       192.168.1.254         192.168.1.2           TCP      94     45658 → 5001 [PSH, ACK] Seq=321 Ack=348 Win=63870 Len=40

Frame 38: 94 bytes on wire (752 bits), 94 bytes captured (752 bits)
Ethernet II, Src: 4e:4a:57:60:5c:cd (4e:4a:57:60:5c:cd), Dst: FANUCROBOTIC_3f:bd:f4 (00:e0:e4:3f:bd:f4)
Internet Protocol Version 4, Src: 192.168.1.254, Dst: 192.168.1.2
Transmission Control Protocol, Src Port: 45658, Dst Port: 5001, Seq: 321, Ack: 348, Len: 40
Data (40 bytes)

0000  a0 a0 a0 a0 00 01 21 01 00 1e 00 01 00 1c 00 01   ......!.........
0010  00 01 00 15 00 00 02 d0 00 00 02 d2 00 00 00 00   ................
0020  00 00 00 00 00 00 00 00                           ........
    Data: a0a0a0a000012101001e0001001c000100010015000002d0000002d2000000000000000000000000
    [Length: 40]

No.     Time           Source                Destination           Protocol Length Info
     40 2.107262       192.168.1.254         192.168.1.2           TCP      94     35796 → 5001 [PSH, ACK] Seq=241 Ack=267 Win=63870 Len=40

Frame 40: 94 bytes on wire (752 bits), 94 bytes captured (752 bits)
Ethernet II, Src: 4e:4a:57:60:5c:cd (4e:4a:57:60:5c:cd), Dst: FANUCROBOTIC_3f:bd:f4 (00:e0:e4:3f:bd:f4)
Internet Protocol Version 4, Src: 192.168.1.254, Dst: 192.168.1.2
Transmission Control Protocol, Src Port: 35796, Dst Port: 5001, Seq: 241, Ack: 267, Len: 40
Data (40 bytes)

0000  a0 a0 a0 a0 00 01 21 01 00 1e 00 01 00 1c 00 02   ......!.........
0010  00 01 80 01 00 00 00 00 00 00 00 00 00 00 00 09   ................
0020  00 00 00 00 00 00 00 00                           ........
    Data: a0a0a0a000012101001e0001001c0002000180010000000000000000000000090000000000000000
    [Length: 40]

No.     Time           Source                Destination           Protocol Length Info
     41 2.108998       192.168.1.254         192.168.1.2           TCP      54     45658 → 5001 [ACK] Seq=361 Ack=400 Win=63870 Len=0

Frame 41: 54 bytes on wire (432 bits), 54 bytes captured (432 bits)
Ethernet II, Src: 4e:4a:57:60:5c:cd (4e:4a:57:60:5c:cd), Dst: FANUCROBOTIC_3f:bd:f4 (00:e0:e4:3f:bd:f4)
Internet Protocol Version 4, Src: 192.168.1.254, Dst: 192.168.1.2
Transmission Control Protocol, Src Port: 45658, Dst Port: 5001, Seq: 361, Ack: 400, Len: 0

No.     Time           Source                Destination           Protocol Length Info
     43 2.118875       192.168.1.254         192.168.1.2           TCP      54     35796 → 5001 [ACK] Seq=281 Ack=296 Win=63870 Len=0

Frame 43: 54 bytes on wire (432 bits), 54 bytes captured (432 bits)
Ethernet II, Src: 4e:4a:57:60:5c:cd (4e:4a:57:60:5c:cd), Dst: FANUCROBOTIC_3f:bd:f4 (00:e0:e4:3f:bd:f4)
Internet Protocol Version 4, Src: 192.168.1.254, Dst: 192.168.1.2
Transmission Control Protocol, Src Port: 35796, Dst Port: 5001, Seq: 281, Ack: 296, Len: 0

No.     Time           Source                Destination           Protocol Length Info
     44 2.119435       192.168.1.254         192.168.1.2           TCP      94     35796 → 5001 [PSH, ACK] Seq=281 Ack=296 Win=63870 Len=40

Frame 44: 94 bytes on wire (752 bits), 94 bytes captured (752 bits)
Ethernet II, Src: 4e:4a:57:60:5c:cd (4e:4a:57:60:5c:cd), Dst: FANUCROBOTIC_3f:bd:f4 (00:e0:e4:3f:bd:f4)
Internet Protocol Version 4, Src: 192.168.1.254, Dst: 192.168.1.2
Transmission Control Protocol, Src Port: 35796, Dst Port: 5001, Seq: 281, Ack: 296, Len: 40
Data (40 bytes)

0000  a0 a0 a0 a0 00 01 21 01 00 1e 00 01 00 1c 00 01   ......!.........
0010  00 02 00 15 00 00 02 d0 00 00 02 d2 00 00 00 00   ................
0020  00 00 00 00 00 00 00 00                           ........
    Data: a0a0a0a000012101001e0001001c000100020015000002d0000002d2000000000000000000000000
    [Length: 40]

No.     Time           Source                Destination           Protocol Length Info
     46 2.140778       192.168.1.254         192.168.1.2           TCP      94     35796 → 5001 [PSH, ACK] Seq=321 Ack=348 Win=63870 Len=40

Frame 46: 94 bytes on wire (752 bits), 94 bytes captured (752 bits)
Ethernet II, Src: 4e:4a:57:60:5c:cd (4e:4a:57:60:5c:cd), Dst: FANUCROBOTIC_3f:bd:f4 (00:e0:e4:3f:bd:f4)
Internet Protocol Version 4, Src: 192.168.1.254, Dst: 192.168.1.2
Transmission Control Protocol, Src Port: 35796, Dst Port: 5001, Seq: 321, Ack: 348, Len: 40
Data (40 bytes)

0000  a0 a0 a0 a0 00 01 21 01 00 1e 00 01 00 1c 00 01   ......!.........
0010  00 01 00 15 00 00 02 d0 00 00 02 d2 00 00 00 00   ................
0020  00 00 00 00 00 00 00 00                           ........
    Data: a0a0a0a000012101001e0001001c000100010015000002d0000002d2000000000000000000000000
    [Length: 40]

No.     Time           Source                Destination           Protocol Length Info
     48 2.212530       192.168.1.254         192.168.1.2           TCP      54     35796 → 5001 [ACK] Seq=361 Ack=400 Win=63870 Len=0

Frame 48: 54 bytes on wire (432 bits), 54 bytes captured (432 bits)
Ethernet II, Src: 4e:4a:57:60:5c:cd (4e:4a:57:60:5c:cd), Dst: FANUCROBOTIC_3f:bd:f4 (00:e0:e4:3f:bd:f4)
Internet Protocol Version 4, Src: 192.168.1.254, Dst: 192.168.1.2
Transmission Control Protocol, Src Port: 35796, Dst Port: 5001, Seq: 361, Ack: 400, Len: 0

No.     Time           Source                Destination           Protocol Length Info
     49 3.004112       192.168.1.254         192.168.1.2           TCP      94     45658 → 5001 [PSH, ACK] Seq=361 Ack=400 Win=63870 Len=40

Frame 49: 94 bytes on wire (752 bits), 94 bytes captured (752 bits)
Ethernet II, Src: 4e:4a:57:60:5c:cd (4e:4a:57:60:5c:cd), Dst: FANUCROBOTIC_3f:bd:f4 (00:e0:e4:3f:bd:f4)
Internet Protocol Version 4, Src: 192.168.1.254, Dst: 192.168.1.2
Transmission Control Protocol, Src Port: 45658, Dst Port: 5001, Seq: 361, Ack: 400, Len: 40
Data (40 bytes)

0000  a0 a0 a0 a0 00 01 21 01 00 1e 00 01 00 1c 00 02   ......!.........
0010  00 01 80 01 00 00 00 00 00 00 00 00 00 00 00 09   ................
0020  00 00 00 00 00 00 00 00                           ........
    Data: a0a0a0a000012101001e0001001c0002000180010000000000000000000000090000000000000000
    [Length: 40]

No.     Time           Source                Destination           Protocol Length Info
     51 3.027794       192.168.1.254         192.168.1.2           TCP      54     45658 → 5001 [ACK] Seq=401 Ack=429 Win=63870 Len=0

Frame 51: 54 bytes on wire (432 bits), 54 bytes captured (432 bits)
Ethernet II, Src: 4e:4a:57:60:5c:cd (4e:4a:57:60:5c:cd), Dst: FANUCROBOTIC_3f:bd:f4 (00:e0:e4:3f:bd:f4)
Internet Protocol Version 4, Src: 192.168.1.254, Dst: 192.168.1.2
Transmission Control Protocol, Src Port: 45658, Dst Port: 5001, Seq: 401, Ack: 429, Len: 0

No.     Time           Source                Destination           Protocol Length Info
     52 3.029471       192.168.1.254         192.168.1.2           TCP      94     45658 → 5001 [PSH, ACK] Seq=401 Ack=429 Win=63870 Len=40

Frame 52: 94 bytes on wire (752 bits), 94 bytes captured (752 bits)
Ethernet II, Src: 4e:4a:57:60:5c:cd (4e:4a:57:60:5c:cd), Dst: FANUCROBOTIC_3f:bd:f4 (00:e0:e4:3f:bd:f4)
Internet Protocol Version 4, Src: 192.168.1.254, Dst: 192.168.1.2
Transmission Control Protocol, Src Port: 45658, Dst Port: 5001, Seq: 401, Ack: 429, Len: 40
Data (40 bytes)

0000  a0 a0 a0 a0 00 01 21 01 00 1e 00 01 00 1c 00 01   ......!.........
0010  00 02 00 15 00 00 02 d0 00 00 02 d2 00 00 00 00   ................
0020  00 00 00 00 00 00 00 00                           ........
    Data: a0a0a0a000012101001e0001001c000100020015000002d0000002d2000000000000000000000000
    [Length: 40]

No.     Time           Source                Destination           Protocol Length Info
     54 3.062628       192.168.1.254         192.168.1.2           TCP      94     45658 → 5001 [PSH, ACK] Seq=441 Ack=481 Win=63870 Len=40

Frame 54: 94 bytes on wire (752 bits), 94 bytes captured (752 bits)
Ethernet II, Src: 4e:4a:57:60:5c:cd (4e:4a:57:60:5c:cd), Dst: FANUCROBOTIC_3f:bd:f4 (00:e0:e4:3f:bd:f4)
Internet Protocol Version 4, Src: 192.168.1.254, Dst: 192.168.1.2
Transmission Control Protocol, Src Port: 45658, Dst Port: 5001, Seq: 441, Ack: 481, Len: 40
Data (40 bytes)

0000  a0 a0 a0 a0 00 01 21 01 00 1e 00 01 00 1c 00 01   ......!.........
0010  00 01 00 15 00 00 02 d0 00 00 02 d2 00 00 00 00   ................
0020  00 00 00 00 00 00 00 00                           ........
    Data: a0a0a0a000012101001e0001001c000100010015000002d0000002d2000000000000000000000000
    [Length: 40]

No.     Time           Source                Destination           Protocol Length Info
     56 3.107891       192.168.1.254         192.168.1.2           TCP      94     35796 → 5001 [PSH, ACK] Seq=361 Ack=400 Win=63870 Len=40

Frame 56: 94 bytes on wire (752 bits), 94 bytes captured (752 bits)
Ethernet II, Src: 4e:4a:57:60:5c:cd (4e:4a:57:60:5c:cd), Dst: FANUCROBOTIC_3f:bd:f4 (00:e0:e4:3f:bd:f4)
Internet Protocol Version 4, Src: 192.168.1.254, Dst: 192.168.1.2
Transmission Control Protocol, Src Port: 35796, Dst Port: 5001, Seq: 361, Ack: 400, Len: 40
Data (40 bytes)

0000  a0 a0 a0 a0 00 01 21 01 00 1e 00 01 00 1c 00 02   ......!.........
0010  00 01 80 01 00 00 00 00 00 00 00 00 00 00 00 09   ................
0020  00 00 00 00 00 00 00 00                           ........
    Data: a0a0a0a000012101001e0001001c0002000180010000000000000000000000090000000000000000
    [Length: 40]

No.     Time           Source                Destination           Protocol Length Info
     58 3.119064       192.168.1.254         192.168.1.2           TCP      54     35796 → 5001 [ACK] Seq=401 Ack=429 Win=63870 Len=0

Frame 58: 54 bytes on wire (432 bits), 54 bytes captured (432 bits)
Ethernet II, Src: 4e:4a:57:60:5c:cd (4e:4a:57:60:5c:cd), Dst: FANUCROBOTIC_3f:bd:f4 (00:e0:e4:3f:bd:f4)
Internet Protocol Version 4, Src: 192.168.1.254, Dst: 192.168.1.2
Transmission Control Protocol, Src Port: 35796, Dst Port: 5001, Seq: 401, Ack: 429, Len: 0

No.     Time           Source                Destination           Protocol Length Info
     59 3.119855       192.168.1.254         192.168.1.2           TCP      94     35796 → 5001 [PSH, ACK] Seq=401 Ack=429 Win=63870 Len=40

Frame 59: 94 bytes on wire (752 bits), 94 bytes captured (752 bits)
Ethernet II, Src: 4e:4a:57:60:5c:cd (4e:4a:57:60:5c:cd), Dst: FANUCROBOTIC_3f:bd:f4 (00:e0:e4:3f:bd:f4)
Internet Protocol Version 4, Src: 192.168.1.254, Dst: 192.168.1.2
Transmission Control Protocol, Src Port: 35796, Dst Port: 5001, Seq: 401, Ack: 429, Len: 40
Data (40 bytes)

0000  a0 a0 a0 a0 00 01 21 01 00 1e 00 01 00 1c 00 01   ......!.........
0010  00 02 00 15 00 00 02 d0 00 00 02 d2 00 00 00 00   ................
0020  00 00 00 00 00 00 00 00                           ........
    Data: a0a0a0a000012101001e0001001c000100020015000002d0000002d2000000000000000000000000
    [Length: 40]

No.     Time           Source                Destination           Protocol Length Info
     60 3.123988       192.168.1.254         192.168.1.2           TCP      54     45658 → 5001 [ACK] Seq=481 Ack=533 Win=63870 Len=0

Frame 60: 54 bytes on wire (432 bits), 54 bytes captured (432 bits)
Ethernet II, Src: 4e:4a:57:60:5c:cd (4e:4a:57:60:5c:cd), Dst: FANUCROBOTIC_3f:bd:f4 (00:e0:e4:3f:bd:f4)
Internet Protocol Version 4, Src: 192.168.1.254, Dst: 192.168.1.2
Transmission Control Protocol, Src Port: 45658, Dst Port: 5001, Seq: 481, Ack: 533, Len: 0

No.     Time           Source                Destination           Protocol Length Info
     62 3.143904       192.168.1.254         192.168.1.2           TCP      94     35796 → 5001 [PSH, ACK] Seq=441 Ack=481 Win=63870 Len=40

Frame 62: 94 bytes on wire (752 bits), 94 bytes captured (752 bits)
Ethernet II, Src: 4e:4a:57:60:5c:cd (4e:4a:57:60:5c:cd), Dst: FANUCROBOTIC_3f:bd:f4 (00:e0:e4:3f:bd:f4)
Internet Protocol Version 4, Src: 192.168.1.254, Dst: 192.168.1.2
Transmission Control Protocol, Src Port: 35796, Dst Port: 5001, Seq: 441, Ack: 481, Len: 40
Data (40 bytes)

0000  a0 a0 a0 a0 00 01 21 01 00 1e 00 01 00 1c 00 01   ......!.........
0010  00 01 00 15 00 00 02 d0 00 00 02 d2 00 00 00 00   ................
0020  00 00 00 00 00 00 00 00                           ........
    Data: a0a0a0a000012101001e0001001c000100010015000002d0000002d2000000000000000000000000
    [Length: 40]

No.     Time           Source                Destination           Protocol Length Info
     64 3.215387       192.168.1.254         192.168.1.2           TCP      54     35796 → 5001 [ACK] Seq=481 Ack=533 Win=63870 Len=0

Frame 64: 54 bytes on wire (432 bits), 54 bytes captured (432 bits)
Ethernet II, Src: 4e:4a:57:60:5c:cd (4e:4a:57:60:5c:cd), Dst: FANUCROBOTIC_3f:bd:f4 (00:e0:e4:3f:bd:f4)
Internet Protocol Version 4, Src: 192.168.1.254, Dst: 192.168.1.2
Transmission Control Protocol, Src Port: 35796, Dst Port: 5001, Seq: 481, Ack: 533, Len: 0

No.     Time           Source                Destination           Protocol Length Info
     65 4.005176       192.168.1.254         192.168.1.2           TCP      94     45658 → 5001 [PSH, ACK] Seq=481 Ack=533 Win=63870 Len=40

Frame 65: 94 bytes on wire (752 bits), 94 bytes captured (752 bits)
Ethernet II, Src: 4e:4a:57:60:5c:cd (4e:4a:57:60:5c:cd), Dst: FANUCROBOTIC_3f:bd:f4 (00:e0:e4:3f:bd:f4)
Internet Protocol Version 4, Src: 192.168.1.254, Dst: 192.168.1.2
Transmission Control Protocol, Src Port: 45658, Dst Port: 5001, Seq: 481, Ack: 533, Len: 40
Data (40 bytes)

0000  a0 a0 a0 a0 00 01 21 01 00 1e 00 01 00 1c 00 02   ......!.........
0010  00 01 80 01 00 00 00 00 00 00 00 00 00 00 00 09   ................
0020  00 00 00 00 00 00 00 00                           ........
    Data: a0a0a0a000012101001e0001001c0002000180010000000000000000000000090000000000000000
    [Length: 40]

No.     Time           Source                Destination           Protocol Length Info
     67 4.027720       192.168.1.254         192.168.1.2           TCP      54     45658 → 5001 [ACK] Seq=521 Ack=562 Win=63870 Len=0

Frame 67: 54 bytes on wire (432 bits), 54 bytes captured (432 bits)
Ethernet II, Src: 4e:4a:57:60:5c:cd (4e:4a:57:60:5c:cd), Dst: FANUCROBOTIC_3f:bd:f4 (00:e0:e4:3f:bd:f4)
Internet Protocol Version 4, Src: 192.168.1.254, Dst: 192.168.1.2
Transmission Control Protocol, Src Port: 45658, Dst Port: 5001, Seq: 521, Ack: 562, Len: 0

No.     Time           Source                Destination           Protocol Length Info
     68 4.029430       192.168.1.254         192.168.1.2           TCP      94     45658 → 5001 [PSH, ACK] Seq=521 Ack=562 Win=63870 Len=40

Frame 68: 94 bytes on wire (752 bits), 94 bytes captured (752 bits)
Ethernet II, Src: 4e:4a:57:60:5c:cd (4e:4a:57:60:5c:cd), Dst: FANUCROBOTIC_3f:bd:f4 (00:e0:e4:3f:bd:f4)
Internet Protocol Version 4, Src: 192.168.1.254, Dst: 192.168.1.2
Transmission Control Protocol, Src Port: 45658, Dst Port: 5001, Seq: 521, Ack: 562, Len: 40
Data (40 bytes)

0000  a0 a0 a0 a0 00 01 21 01 00 1e 00 01 00 1c 00 01   ......!.........
0010  00 02 00 15 00 00 02 d0 00 00 02 d2 00 00 00 00   ................
0020  00 00 00 00 00 00 00 00                           ........
    Data: a0a0a0a000012101001e0001001c000100020015000002d0000002d2000000000000000000000000
    [Length: 40]

No.     Time           Source                Destination           Protocol Length Info
     70 4.054633       192.168.1.254         192.168.1.2           TCP      94     45658 → 5001 [PSH, ACK] Seq=561 Ack=614 Win=63870 Len=40

Frame 70: 94 bytes on wire (752 bits), 94 bytes captured (752 bits)
Ethernet II, Src: 4e:4a:57:60:5c:cd (4e:4a:57:60:5c:cd), Dst: FANUCROBOTIC_3f:bd:f4 (00:e0:e4:3f:bd:f4)
Internet Protocol Version 4, Src: 192.168.1.254, Dst: 192.168.1.2
Transmission Control Protocol, Src Port: 45658, Dst Port: 5001, Seq: 561, Ack: 614, Len: 40
Data (40 bytes)

0000  a0 a0 a0 a0 00 01 21 01 00 1e 00 01 00 1c 00 01   ......!.........
0010  00 01 00 15 00 00 02 d0 00 00 02 d2 00 00 00 00   ................
0020  00 00 00 00 00 00 00 00                           ........
    Data: a0a0a0a000012101001e0001001c000100010015000002d0000002d2000000000000000000000000
    [Length: 40]

No.     Time           Source                Destination           Protocol Length Info
     72 4.108321       192.168.1.254         192.168.1.2           TCP      94     35796 → 5001 [PSH, ACK] Seq=481 Ack=533 Win=63870 Len=40

Frame 72: 94 bytes on wire (752 bits), 94 bytes captured (752 bits)
Ethernet II, Src: 4e:4a:57:60:5c:cd (4e:4a:57:60:5c:cd), Dst: FANUCROBOTIC_3f:bd:f4 (00:e0:e4:3f:bd:f4)
Internet Protocol Version 4, Src: 192.168.1.254, Dst: 192.168.1.2
Transmission Control Protocol, Src Port: 35796, Dst Port: 5001, Seq: 481, Ack: 533, Len: 40
Data (40 bytes)

0000  a0 a0 a0 a0 00 01 21 01 00 1e 00 01 00 1c 00 02   ......!.........
0010  00 01 80 01 00 00 00 00 00 00 00 00 00 00 00 09   ................
0020  00 00 00 00 00 00 00 00                           ........
    Data: a0a0a0a000012101001e0001001c0002000180010000000000000000000000090000000000000000
    [Length: 40]

No.     Time           Source                Destination           Protocol Length Info
     73 4.115986       192.168.1.254         192.168.1.2           TCP      54     45658 → 5001 [ACK] Seq=601 Ack=666 Win=63870 Len=0

Frame 73: 54 bytes on wire (432 bits), 54 bytes captured (432 bits)
Ethernet II, Src: 4e:4a:57:60:5c:cd (4e:4a:57:60:5c:cd), Dst: FANUCROBOTIC_3f:bd:f4 (00:e0:e4:3f:bd:f4)
Internet Protocol Version 4, Src: 192.168.1.254, Dst: 192.168.1.2
Transmission Control Protocol, Src Port: 45658, Dst Port: 5001, Seq: 601, Ack: 666, Len: 0

No.     Time           Source                Destination           Protocol Length Info
     75 4.118935       192.168.1.254         192.168.1.2           TCP      54     35796 → 5001 [ACK] Seq=521 Ack=562 Win=63870 Len=0

Frame 75: 54 bytes on wire (432 bits), 54 bytes captured (432 bits)
Ethernet II, Src: 4e:4a:57:60:5c:cd (4e:4a:57:60:5c:cd), Dst: FANUCROBOTIC_3f:bd:f4 (00:e0:e4:3f:bd:f4)
Internet Protocol Version 4, Src: 192.168.1.254, Dst: 192.168.1.2
Transmission Control Protocol, Src Port: 35796, Dst Port: 5001, Seq: 521, Ack: 562, Len: 0

No.     Time           Source                Destination           Protocol Length Info
     76 4.119531       192.168.1.254         192.168.1.2           TCP      94     35796 → 5001 [PSH, ACK] Seq=521 Ack=562 Win=63870 Len=40

Frame 76: 94 bytes on wire (752 bits), 94 bytes captured (752 bits)
Ethernet II, Src: 4e:4a:57:60:5c:cd (4e:4a:57:60:5c:cd), Dst: FANUCROBOTIC_3f:bd:f4 (00:e0:e4:3f:bd:f4)
Internet Protocol Version 4, Src: 192.168.1.254, Dst: 192.168.1.2
Transmission Control Protocol, Src Port: 35796, Dst Port: 5001, Seq: 521, Ack: 562, Len: 40
Data (40 bytes)

0000  a0 a0 a0 a0 00 01 21 01 00 1e 00 01 00 1c 00 01   ......!.........
0010  00 02 00 15 00 00 02 d0 00 00 02 d2 00 00 00 00   ................
0020  00 00 00 00 00 00 00 00                           ........
    Data: a0a0a0a000012101001e0001001c000100020015000002d0000002d2000000000000000000000000
    [Length: 40]

No.     Time           Source                Destination           Protocol Length Info
     78 4.152101       192.168.1.254         192.168.1.2           TCP      94     35796 → 5001 [PSH, ACK] Seq=561 Ack=614 Win=63870 Len=40

Frame 78: 94 bytes on wire (752 bits), 94 bytes captured (752 bits)
Ethernet II, Src: 4e:4a:57:60:5c:cd (4e:4a:57:60:5c:cd), Dst: FANUCROBOTIC_3f:bd:f4 (00:e0:e4:3f:bd:f4)
Internet Protocol Version 4, Src: 192.168.1.254, Dst: 192.168.1.2
Transmission Control Protocol, Src Port: 35796, Dst Port: 5001, Seq: 561, Ack: 614, Len: 40
Data (40 bytes)

0000  a0 a0 a0 a0 00 01 21 01 00 1e 00 01 00 1c 00 01   ......!.........
0010  00 01 00 15 00 00 02 d0 00 00 02 d2 00 00 00 00   ................
0020  00 00 00 00 00 00 00 00                           ........
    Data: a0a0a0a000012101001e0001001c000100010015000002d0000002d2000000000000000000000000
    [Length: 40]

No.     Time           Source                Destination           Protocol Length Info
     80 4.212386       192.168.1.254         192.168.1.2           TCP      54     35796 → 5001 [ACK] Seq=601 Ack=666 Win=63870 Len=0

Frame 80: 54 bytes on wire (432 bits), 54 bytes captured (432 bits)
Ethernet II, Src: 4e:4a:57:60:5c:cd (4e:4a:57:60:5c:cd), Dst: FANUCROBOTIC_3f:bd:f4 (00:e0:e4:3f:bd:f4)
Internet Protocol Version 4, Src: 192.168.1.254, Dst: 192.168.1.2
Transmission Control Protocol, Src Port: 35796, Dst Port: 5001, Seq: 601, Ack: 666, Len: 0

No.     Time           Source                Destination           Protocol Length Info
     81 5.007097       192.168.1.254         192.168.1.2           TCP      94     45658 → 5001 [PSH, ACK] Seq=601 Ack=666 Win=63870 Len=40

Frame 81: 94 bytes on wire (752 bits), 94 bytes captured (752 bits)
Ethernet II, Src: 4e:4a:57:60:5c:cd (4e:4a:57:60:5c:cd), Dst: FANUCROBOTIC_3f:bd:f4 (00:e0:e4:3f:bd:f4)
Internet Protocol Version 4, Src: 192.168.1.254, Dst: 192.168.1.2
Transmission Control Protocol, Src Port: 45658, Dst Port: 5001, Seq: 601, Ack: 666, Len: 40
Data (40 bytes)

0000  a0 a0 a0 a0 00 01 21 01 00 1e 00 01 00 1c 00 02   ......!.........
0010  00 01 80 01 00 00 00 00 00 00 00 00 00 00 00 09   ................
0020  00 00 00 00 00 00 00 00                           ........
    Data: a0a0a0a000012101001e0001001c0002000180010000000000000000000000090000000000000000
    [Length: 40]

No.     Time           Source                Destination           Protocol Length Info
     83 5.035786       192.168.1.254         192.168.1.2           TCP      54     45658 → 5001 [ACK] Seq=641 Ack=695 Win=63870 Len=0

Frame 83: 54 bytes on wire (432 bits), 54 bytes captured (432 bits)
Ethernet II, Src: 4e:4a:57:60:5c:cd (4e:4a:57:60:5c:cd), Dst: FANUCROBOTIC_3f:bd:f4 (00:e0:e4:3f:bd:f4)
Internet Protocol Version 4, Src: 192.168.1.254, Dst: 192.168.1.2
Transmission Control Protocol, Src Port: 45658, Dst Port: 5001, Seq: 641, Ack: 695, Len: 0

No.     Time           Source                Destination           Protocol Length Info
     84 5.037564       192.168.1.254         192.168.1.2           TCP      94     45658 → 5001 [PSH, ACK] Seq=641 Ack=695 Win=63870 Len=40

Frame 84: 94 bytes on wire (752 bits), 94 bytes captured (752 bits)
Ethernet II, Src: 4e:4a:57:60:5c:cd (4e:4a:57:60:5c:cd), Dst: FANUCROBOTIC_3f:bd:f4 (00:e0:e4:3f:bd:f4)
Internet Protocol Version 4, Src: 192.168.1.254, Dst: 192.168.1.2
Transmission Control Protocol, Src Port: 45658, Dst Port: 5001, Seq: 641, Ack: 695, Len: 40
Data (40 bytes)

0000  a0 a0 a0 a0 00 01 21 01 00 1e 00 01 00 1c 00 01   ......!.........
0010  00 02 00 15 00 00 02 d0 00 00 02 d2 00 00 00 00   ................
0020  00 00 00 00 00 00 00 00                           ........
    Data: a0a0a0a000012101001e0001001c000100020015000002d0000002d2000000000000000000000000
    [Length: 40]

No.     Time           Source                Destination           Protocol Length Info
     86 5.058731       192.168.1.254         192.168.1.2           TCP      94     45658 → 5001 [PSH, ACK] Seq=681 Ack=747 Win=63870 Len=40

Frame 86: 94 bytes on wire (752 bits), 94 bytes captured (752 bits)
Ethernet II, Src: 4e:4a:57:60:5c:cd (4e:4a:57:60:5c:cd), Dst: FANUCROBOTIC_3f:bd:f4 (00:e0:e4:3f:bd:f4)
Internet Protocol Version 4, Src: 192.168.1.254, Dst: 192.168.1.2
Transmission Control Protocol, Src Port: 45658, Dst Port: 5001, Seq: 681, Ack: 747, Len: 40
Data (40 bytes)

0000  a0 a0 a0 a0 00 01 21 01 00 1e 00 01 00 1c 00 01   ......!.........
0010  00 01 00 15 00 00 02 d0 00 00 02 d2 00 00 00 00   ................
0020  00 00 00 00 00 00 00 00                           ........
    Data: a0a0a0a000012101001e0001001c000100010015000002d0000002d2000000000000000000000000
    [Length: 40]

No.     Time           Source                Destination           Protocol Length Info
     88 5.109054       192.168.1.254         192.168.1.2           TCP      94     35796 → 5001 [PSH, ACK] Seq=601 Ack=666 Win=63870 Len=40

Frame 88: 94 bytes on wire (752 bits), 94 bytes captured (752 bits)
Ethernet II, Src: 4e:4a:57:60:5c:cd (4e:4a:57:60:5c:cd), Dst: FANUCROBOTIC_3f:bd:f4 (00:e0:e4:3f:bd:f4)
Internet Protocol Version 4, Src: 192.168.1.254, Dst: 192.168.1.2
Transmission Control Protocol, Src Port: 35796, Dst Port: 5001, Seq: 601, Ack: 666, Len: 40
Data (40 bytes)

0000  a0 a0 a0 a0 00 01 21 01 00 1e 00 01 00 1c 00 02   ......!.........
0010  00 01 80 01 00 00 00 00 00 00 00 00 00 00 00 09   ................
0020  00 00 00 00 00 00 00 00                           ........
    Data: a0a0a0a000012101001e0001001c0002000180010000000000000000000000090000000000000000
    [Length: 40]

No.     Time           Source                Destination           Protocol Length Info
     89 5.113036       192.168.1.254         192.168.1.2           TCP      54     45658 → 5001 [ACK] Seq=721 Ack=799 Win=63870 Len=0

Frame 89: 54 bytes on wire (432 bits), 54 bytes captured (432 bits)
Ethernet II, Src: 4e:4a:57:60:5c:cd (4e:4a:57:60:5c:cd), Dst: FANUCROBOTIC_3f:bd:f4 (00:e0:e4:3f:bd:f4)
Internet Protocol Version 4, Src: 192.168.1.254, Dst: 192.168.1.2
Transmission Control Protocol, Src Port: 45658, Dst Port: 5001, Seq: 721, Ack: 799, Len: 0

No.     Time           Source                Destination           Protocol Length Info
     91 5.126908       192.168.1.254         192.168.1.2           TCP      54     35796 → 5001 [ACK] Seq=641 Ack=695 Win=63870 Len=0

Frame 91: 54 bytes on wire (432 bits), 54 bytes captured (432 bits)
Ethernet II, Src: 4e:4a:57:60:5c:cd (4e:4a:57:60:5c:cd), Dst: FANUCROBOTIC_3f:bd:f4 (00:e0:e4:3f:bd:f4)
Internet Protocol Version 4, Src: 192.168.1.254, Dst: 192.168.1.2
Transmission Control Protocol, Src Port: 35796, Dst Port: 5001, Seq: 641, Ack: 695, Len: 0

No.     Time           Source                Destination           Protocol Length Info
     92 5.127767       192.168.1.254         192.168.1.2           TCP      94     35796 → 5001 [PSH, ACK] Seq=641 Ack=695 Win=63870 Len=40

Frame 92: 94 bytes on wire (752 bits), 94 bytes captured (752 bits)
Ethernet II, Src: 4e:4a:57:60:5c:cd (4e:4a:57:60:5c:cd), Dst: FANUCROBOTIC_3f:bd:f4 (00:e0:e4:3f:bd:f4)
Internet Protocol Version 4, Src: 192.168.1.254, Dst: 192.168.1.2
Transmission Control Protocol, Src Port: 35796, Dst Port: 5001, Seq: 641, Ack: 695, Len: 40
Data (40 bytes)

0000  a0 a0 a0 a0 00 01 21 01 00 1e 00 01 00 1c 00 01   ......!.........
0010  00 02 00 15 00 00 02 d0 00 00 02 d2 00 00 00 00   ................
0020  00 00 00 00 00 00 00 00                           ........
    Data: a0a0a0a000012101001e0001001c000100020015000002d0000002d2000000000000000000000000
    [Length: 40]

No.     Time           Source                Destination           Protocol Length Info
     94 5.149188       192.168.1.254         192.168.1.2           TCP      94     35796 → 5001 [PSH, ACK] Seq=681 Ack=747 Win=63870 Len=40

Frame 94: 94 bytes on wire (752 bits), 94 bytes captured (752 bits)
Ethernet II, Src: 4e:4a:57:60:5c:cd (4e:4a:57:60:5c:cd), Dst: FANUCROBOTIC_3f:bd:f4 (00:e0:e4:3f:bd:f4)
Internet Protocol Version 4, Src: 192.168.1.254, Dst: 192.168.1.2
Transmission Control Protocol, Src Port: 35796, Dst Port: 5001, Seq: 681, Ack: 747, Len: 40
Data (40 bytes)

0000  a0 a0 a0 a0 00 01 21 01 00 1e 00 01 00 1c 00 01   ......!.........
0010  00 01 00 15 00 00 02 d0 00 00 02 d2 00 00 00 00   ................
0020  00 00 00 00 00 00 00 00                           ........
    Data: a0a0a0a000012101001e0001001c000100010015000002d0000002d2000000000000000000000000
    [Length: 40]

No.     Time           Source                Destination           Protocol Length Info
     96 5.199394       192.168.1.254         192.168.1.2           TCP      54     35796 → 5001 [ACK] Seq=721 Ack=799 Win=63870 Len=0

Frame 96: 54 bytes on wire (432 bits), 54 bytes captured (432 bits)
Ethernet II, Src: 4e:4a:57:60:5c:cd (4e:4a:57:60:5c:cd), Dst: FANUCROBOTIC_3f:bd:f4 (00:e0:e4:3f:bd:f4)
Internet Protocol Version 4, Src: 192.168.1.254, Dst: 192.168.1.2
Transmission Control Protocol, Src Port: 35796, Dst Port: 5001, Seq: 721, Ack: 799, Len: 0

No.     Time           Source                Destination           Protocol Length Info
     97 6.008041       192.168.1.254         192.168.1.2           TCP      94     45658 → 5001 [PSH, ACK] Seq=721 Ack=799 Win=63870 Len=40

Frame 97: 94 bytes on wire (752 bits), 94 bytes captured (752 bits)
Ethernet II, Src: 4e:4a:57:60:5c:cd (4e:4a:57:60:5c:cd), Dst: FANUCROBOTIC_3f:bd:f4 (00:e0:e4:3f:bd:f4)
Internet Protocol Version 4, Src: 192.168.1.254, Dst: 192.168.1.2
Transmission Control Protocol, Src Port: 45658, Dst Port: 5001, Seq: 721, Ack: 799, Len: 40
Data (40 bytes)

0000  a0 a0 a0 a0 00 01 21 01 00 1e 00 01 00 1c 00 02   ......!.........
0010  00 01 80 01 00 00 00 00 00 00 00 00 00 00 00 09   ................
0020  00 00 00 00 00 00 00 00                           ........
    Data: a0a0a0a000012101001e0001001c0002000180010000000000000000000000090000000000000000
    [Length: 40]

No.     Time           Source                Destination           Protocol Length Info
     99 6.048024       192.168.1.254         192.168.1.2           TCP      54     45658 → 5001 [ACK] Seq=761 Ack=828 Win=63870 Len=0

Frame 99: 54 bytes on wire (432 bits), 54 bytes captured (432 bits)
Ethernet II, Src: 4e:4a:57:60:5c:cd (4e:4a:57:60:5c:cd), Dst: FANUCROBOTIC_3f:bd:f4 (00:e0:e4:3f:bd:f4)
Internet Protocol Version 4, Src: 192.168.1.254, Dst: 192.168.1.2
Transmission Control Protocol, Src Port: 45658, Dst Port: 5001, Seq: 761, Ack: 828, Len: 0

No.     Time           Source                Destination           Protocol Length Info
    100 6.049731       192.168.1.254         192.168.1.2           TCP      94     45658 → 5001 [PSH, ACK] Seq=761 Ack=828 Win=63870 Len=40

Frame 100: 94 bytes on wire (752 bits), 94 bytes captured (752 bits)
Ethernet II, Src: 4e:4a:57:60:5c:cd (4e:4a:57:60:5c:cd), Dst: FANUCROBOTIC_3f:bd:f4 (00:e0:e4:3f:bd:f4)
Internet Protocol Version 4, Src: 192.168.1.254, Dst: 192.168.1.2
Transmission Control Protocol, Src Port: 45658, Dst Port: 5001, Seq: 761, Ack: 828, Len: 40
Data (40 bytes)

0000  a0 a0 a0 a0 00 01 21 01 00 1e 00 01 00 1c 00 01   ......!.........
0010  00 02 00 15 00 00 02 d0 00 00 02 d2 00 00 00 00   ................
0020  00 00 00 00 00 00 00 00                           ........
    Data: a0a0a0a000012101001e0001001c000100020015000002d0000002d2000000000000000000000000
    [Length: 40]

No.     Time           Source                Destination           Protocol Length Info
    102 6.070795       192.168.1.254         192.168.1.2           TCP      94     45658 → 5001 [PSH, ACK] Seq=801 Ack=880 Win=63870 Len=40

Frame 102: 94 bytes on wire (752 bits), 94 bytes captured (752 bits)
Ethernet II, Src: 4e:4a:57:60:5c:cd (4e:4a:57:60:5c:cd), Dst: FANUCROBOTIC_3f:bd:f4 (00:e0:e4:3f:bd:f4)
Internet Protocol Version 4, Src: 192.168.1.254, Dst: 192.168.1.2
Transmission Control Protocol, Src Port: 45658, Dst Port: 5001, Seq: 801, Ack: 880, Len: 40
Data (40 bytes)

0000  a0 a0 a0 a0 00 01 21 01 00 1e 00 01 00 1c 00 01   ......!.........
0010  00 01 00 15 00 00 02 d0 00 00 02 d2 00 00 00 00   ................
0020  00 00 00 00 00 00 00 00                           ........
    Data: a0a0a0a000012101001e0001001c000100010015000002d0000002d2000000000000000000000000
    [Length: 40]

No.     Time           Source                Destination           Protocol Length Info
    103 6.110049       192.168.1.254         192.168.1.2           TCP      94     35796 → 5001 [PSH, ACK] Seq=721 Ack=799 Win=63870 Len=40

Frame 103: 94 bytes on wire (752 bits), 94 bytes captured (752 bits)
Ethernet II, Src: 4e:4a:57:60:5c:cd (4e:4a:57:60:5c:cd), Dst: FANUCROBOTIC_3f:bd:f4 (00:e0:e4:3f:bd:f4)
Internet Protocol Version 4, Src: 192.168.1.254, Dst: 192.168.1.2
Transmission Control Protocol, Src Port: 35796, Dst Port: 5001, Seq: 721, Ack: 799, Len: 40
Data (40 bytes)

0000  a0 a0 a0 a0 00 01 21 01 00 1e 00 01 00 1c 00 02   ......!.........
0010  00 01 80 01 00 00 00 00 00 00 00 00 00 00 00 09   ................
0020  00 00 00 00 00 00 00 00                           ........
    Data: a0a0a0a000012101001e0001001c0002000180010000000000000000000000090000000000000000
    [Length: 40]

No.     Time           Source                Destination           Protocol Length Info
    105 6.127231       192.168.1.254         192.168.1.2           TCP      54     35796 → 5001 [ACK] Seq=761 Ack=828 Win=63870 Len=0

Frame 105: 54 bytes on wire (432 bits), 54 bytes captured (432 bits)
Ethernet II, Src: 4e:4a:57:60:5c:cd (4e:4a:57:60:5c:cd), Dst: FANUCROBOTIC_3f:bd:f4 (00:e0:e4:3f:bd:f4)
Internet Protocol Version 4, Src: 192.168.1.254, Dst: 192.168.1.2
Transmission Control Protocol, Src Port: 35796, Dst Port: 5001, Seq: 761, Ack: 828, Len: 0

No.     Time           Source                Destination           Protocol Length Info
    106 6.127909       192.168.1.254         192.168.1.2           TCP      94     35796 → 5001 [PSH, ACK] Seq=761 Ack=828 Win=63870 Len=40

Frame 106: 94 bytes on wire (752 bits), 94 bytes captured (752 bits)
Ethernet II, Src: 4e:4a:57:60:5c:cd (4e:4a:57:60:5c:cd), Dst: FANUCROBOTIC_3f:bd:f4 (00:e0:e4:3f:bd:f4)
Internet Protocol Version 4, Src: 192.168.1.254, Dst: 192.168.1.2
Transmission Control Protocol, Src Port: 35796, Dst Port: 5001, Seq: 761, Ack: 828, Len: 40
Data (40 bytes)

0000  a0 a0 a0 a0 00 01 21 01 00 1e 00 01 00 1c 00 01   ......!.........
0010  00 02 00 15 00 00 02 d0 00 00 02 d2 00 00 00 00   ................
0020  00 00 00 00 00 00 00 00                           ........
    Data: a0a0a0a000012101001e0001001c000100020015000002d0000002d2000000000000000000000000
    [Length: 40]

No.     Time           Source                Destination           Protocol Length Info
    109 6.152185       192.168.1.254         192.168.1.2           TCP      94     35796 → 5001 [PSH, ACK] Seq=801 Ack=880 Win=63870 Len=40

Frame 109: 94 bytes on wire (752 bits), 94 bytes captured (752 bits)
Ethernet II, Src: 4e:4a:57:60:5c:cd (4e:4a:57:60:5c:cd), Dst: FANUCROBOTIC_3f:bd:f4 (00:e0:e4:3f:bd:f4)
Internet Protocol Version 4, Src: 192.168.1.254, Dst: 192.168.1.2
Transmission Control Protocol, Src Port: 35796, Dst Port: 5001, Seq: 801, Ack: 880, Len: 40
Data (40 bytes)

0000  a0 a0 a0 a0 00 01 21 01 00 1e 00 01 00 1c 00 01   ......!.........
0010  00 01 00 15 00 00 02 d0 00 00 02 d2 00 00 00 00   ................
0020  00 00 00 00 00 00 00 00                           ........
    Data: a0a0a0a000012101001e0001001c000100010015000002d0000002d2000000000000000000000000
    [Length: 40]

No.     Time           Source                Destination           Protocol Length Info
    111 6.172985       192.168.1.254         192.168.1.2           TCP      54     45658 → 5001 [ACK] Seq=841 Ack=932 Win=63870 Len=0

Frame 111: 54 bytes on wire (432 bits), 54 bytes captured (432 bits)
Ethernet II, Src: 4e:4a:57:60:5c:cd (4e:4a:57:60:5c:cd), Dst: FANUCROBOTIC_3f:bd:f4 (00:e0:e4:3f:bd:f4)
Internet Protocol Version 4, Src: 192.168.1.254, Dst: 192.168.1.2
Transmission Control Protocol, Src Port: 45658, Dst Port: 5001, Seq: 841, Ack: 932, Len: 0

No.     Time           Source                Destination           Protocol Length Info
    112 6.212417       192.168.1.254         192.168.1.2           TCP      54     35796 → 5001 [ACK] Seq=841 Ack=932 Win=63870 Len=0

Frame 112: 54 bytes on wire (432 bits), 54 bytes captured (432 bits)
Ethernet II, Src: 4e:4a:57:60:5c:cd (4e:4a:57:60:5c:cd), Dst: FANUCROBOTIC_3f:bd:f4 (00:e0:e4:3f:bd:f4)
Internet Protocol Version 4, Src: 192.168.1.254, Dst: 192.168.1.2
Transmission Control Protocol, Src Port: 35796, Dst Port: 5001, Seq: 841, Ack: 932, Len: 0

No.     Time           Source                Destination           Protocol Length Info
    113 7.009043       192.168.1.254         192.168.1.2           TCP      94     45658 → 5001 [PSH, ACK] Seq=841 Ack=932 Win=63870 Len=40

Frame 113: 94 bytes on wire (752 bits), 94 bytes captured (752 bits)
Ethernet II, Src: 4e:4a:57:60:5c:cd (4e:4a:57:60:5c:cd), Dst: FANUCROBOTIC_3f:bd:f4 (00:e0:e4:3f:bd:f4)
Internet Protocol Version 4, Src: 192.168.1.254, Dst: 192.168.1.2
Transmission Control Protocol, Src Port: 45658, Dst Port: 5001, Seq: 841, Ack: 932, Len: 40
Data (40 bytes)

0000  a0 a0 a0 a0 00 01 21 01 00 1e 00 01 00 1c 00 02   ......!.........
0010  00 01 80 01 00 00 00 00 00 00 00 00 00 00 00 09   ................
0020  00 00 00 00 00 00 00 00                           ........
    Data: a0a0a0a000012101001e0001001c0002000180010000000000000000000000090000000000000000
    [Length: 40]

No.     Time           Source                Destination           Protocol Length Info
    115 7.015008       192.168.1.254         192.168.1.2           TCP      54     45658 → 5001 [ACK] Seq=881 Ack=961 Win=63870 Len=0

Frame 115: 54 bytes on wire (432 bits), 54 bytes captured (432 bits)
Ethernet II, Src: 4e:4a:57:60:5c:cd (4e:4a:57:60:5c:cd), Dst: FANUCROBOTIC_3f:bd:f4 (00:e0:e4:3f:bd:f4)
Internet Protocol Version 4, Src: 192.168.1.254, Dst: 192.168.1.2
Transmission Control Protocol, Src Port: 45658, Dst Port: 5001, Seq: 881, Ack: 961, Len: 0

No.     Time           Source                Destination           Protocol Length Info
    116 7.016563       192.168.1.254         192.168.1.2           TCP      94     45658 → 5001 [PSH, ACK] Seq=881 Ack=961 Win=63870 Len=40

Frame 116: 94 bytes on wire (752 bits), 94 bytes captured (752 bits)
Ethernet II, Src: 4e:4a:57:60:5c:cd (4e:4a:57:60:5c:cd), Dst: FANUCROBOTIC_3f:bd:f4 (00:e0:e4:3f:bd:f4)
Internet Protocol Version 4, Src: 192.168.1.254, Dst: 192.168.1.2
Transmission Control Protocol, Src Port: 45658, Dst Port: 5001, Seq: 881, Ack: 961, Len: 40
Data (40 bytes)

0000  a0 a0 a0 a0 00 01 21 01 00 1e 00 01 00 1c 00 01   ......!.........
0010  00 02 00 15 00 00 02 d0 00 00 02 d2 00 00 00 00   ................
0020  00 00 00 00 00 00 00 00                           ........
    Data: a0a0a0a000012101001e0001001c000100020015000002d0000002d2000000000000000000000000
    [Length: 40]

No.     Time           Source                Destination           Protocol Length Info
    118 7.038755       192.168.1.254         192.168.1.2           TCP      94     45658 → 5001 [PSH, ACK] Seq=921 Ack=1013 Win=63870 Len=40

Frame 118: 94 bytes on wire (752 bits), 94 bytes captured (752 bits)
Ethernet II, Src: 4e:4a:57:60:5c:cd (4e:4a:57:60:5c:cd), Dst: FANUCROBOTIC_3f:bd:f4 (00:e0:e4:3f:bd:f4)
Internet Protocol Version 4, Src: 192.168.1.254, Dst: 192.168.1.2
Transmission Control Protocol, Src Port: 45658, Dst Port: 5001, Seq: 921, Ack: 1013, Len: 40
Data (40 bytes)

0000  a0 a0 a0 a0 00 01 21 01 00 1e 00 01 00 1c 00 01   ......!.........
0010  00 01 00 15 00 00 02 d0 00 00 02 d2 00 00 00 00   ................
0020  00 00 00 00 00 00 00 00                           ........
    Data: a0a0a0a000012101001e0001001c000100010015000002d0000002d2000000000000000000000000
    [Length: 40]

No.     Time           Source                Destination           Protocol Length Info
    119 7.046441       192.168.1.254         192.168.1.2           TCP      66     60944 → 2222 [SYN] Seq=0 Win=64240 Len=0 MSS=1460 WS=256 SACK_PERM

Frame 119: 66 bytes on wire (528 bits), 66 bytes captured (528 bits)
Ethernet II, Src: 4e:4a:57:60:5c:cd (4e:4a:57:60:5c:cd), Dst: FANUCROBOTIC_3f:bd:f4 (00:e0:e4:3f:bd:f4)
Internet Protocol Version 4, Src: 192.168.1.254, Dst: 192.168.1.2
Transmission Control Protocol, Src Port: 60944, Dst Port: 2222, Seq: 0, Len: 0

No.     Time           Source                Destination           Protocol Length Info
    122 7.091987       192.168.1.254         192.168.1.2           TCP      54     45658 → 5001 [ACK] Seq=961 Ack=1065 Win=63870 Len=0

Frame 122: 54 bytes on wire (432 bits), 54 bytes captured (432 bits)
Ethernet II, Src: 4e:4a:57:60:5c:cd (4e:4a:57:60:5c:cd), Dst: FANUCROBOTIC_3f:bd:f4 (00:e0:e4:3f:bd:f4)
Internet Protocol Version 4, Src: 192.168.1.254, Dst: 192.168.1.2
Transmission Control Protocol, Src Port: 45658, Dst Port: 5001, Seq: 961, Ack: 1065, Len: 0

No.     Time           Source                Destination           Protocol Length Info
    123 7.111138       192.168.1.254         192.168.1.2           TCP      94     35796 → 5001 [PSH, ACK] Seq=841 Ack=932 Win=63870 Len=40

Frame 123: 94 bytes on wire (752 bits), 94 bytes captured (752 bits)
Ethernet II, Src: 4e:4a:57:60:5c:cd (4e:4a:57:60:5c:cd), Dst: FANUCROBOTIC_3f:bd:f4 (00:e0:e4:3f:bd:f4)
Internet Protocol Version 4, Src: 192.168.1.254, Dst: 192.168.1.2
Transmission Control Protocol, Src Port: 35796, Dst Port: 5001, Seq: 841, Ack: 932, Len: 40
Data (40 bytes)

0000  a0 a0 a0 a0 00 01 21 01 00 1e 00 01 00 1c 00 02   ......!.........
0010  00 01 80 01 00 00 00 00 00 00 00 00 00 00 00 09   ................
0020  00 00 00 00 00 00 00 00                           ........
    Data: a0a0a0a000012101001e0001001c0002000180010000000000000000000000090000000000000000
    [Length: 40]

No.     Time           Source                Destination           Protocol Length Info
    125 7.123804       192.168.1.254         192.168.1.2           TCP      54     35796 → 5001 [ACK] Seq=881 Ack=961 Win=63870 Len=0

Frame 125: 54 bytes on wire (432 bits), 54 bytes captured (432 bits)
Ethernet II, Src: 4e:4a:57:60:5c:cd (4e:4a:57:60:5c:cd), Dst: FANUCROBOTIC_3f:bd:f4 (00:e0:e4:3f:bd:f4)
Internet Protocol Version 4, Src: 192.168.1.254, Dst: 192.168.1.2
Transmission Control Protocol, Src Port: 35796, Dst Port: 5001, Seq: 881, Ack: 961, Len: 0

No.     Time           Source                Destination           Protocol Length Info
    126 7.124413       192.168.1.254         192.168.1.2           TCP      94     35796 → 5001 [PSH, ACK] Seq=881 Ack=961 Win=63870 Len=40

Frame 126: 94 bytes on wire (752 bits), 94 bytes captured (752 bits)
Ethernet II, Src: 4e:4a:57:60:5c:cd (4e:4a:57:60:5c:cd), Dst: FANUCROBOTIC_3f:bd:f4 (00:e0:e4:3f:bd:f4)
Internet Protocol Version 4, Src: 192.168.1.254, Dst: 192.168.1.2
Transmission Control Protocol, Src Port: 35796, Dst Port: 5001, Seq: 881, Ack: 961, Len: 40
Data (40 bytes)

0000  a0 a0 a0 a0 00 01 21 01 00 1e 00 01 00 1c 00 01   ......!.........
0010  00 02 00 15 00 00 02 d0 00 00 02 d2 00 00 00 00   ................
0020  00 00 00 00 00 00 00 00                           ........
    Data: a0a0a0a000012101001e0001001c000100020015000002d0000002d2000000000000000000000000
    [Length: 40]

No.     Time           Source                Destination           Protocol Length Info
    128 7.143973       192.168.1.254         192.168.1.2           TCP      94     35796 → 5001 [PSH, ACK] Seq=921 Ack=1013 Win=63870 Len=40

Frame 128: 94 bytes on wire (752 bits), 94 bytes captured (752 bits)
Ethernet II, Src: 4e:4a:57:60:5c:cd (4e:4a:57:60:5c:cd), Dst: FANUCROBOTIC_3f:bd:f4 (00:e0:e4:3f:bd:f4)
Internet Protocol Version 4, Src: 192.168.1.254, Dst: 192.168.1.2
Transmission Control Protocol, Src Port: 35796, Dst Port: 5001, Seq: 921, Ack: 1013, Len: 40
Data (40 bytes)

0000  a0 a0 a0 a0 00 01 21 01 00 1e 00 01 00 1c 00 01   ......!.........
0010  00 01 00 15 00 00 02 d0 00 00 02 d2 00 00 00 00   ................
0020  00 00 00 00 00 00 00 00                           ........
    Data: a0a0a0a000012101001e0001001c000100010015000002d0000002d2000000000000000000000000
    [Length: 40]

No.     Time           Source                Destination           Protocol Length Info
    130 7.199391       192.168.1.254         192.168.1.2           TCP      54     35796 → 5001 [ACK] Seq=961 Ack=1065 Win=63870 Len=0

Frame 130: 54 bytes on wire (432 bits), 54 bytes captured (432 bits)
Ethernet II, Src: 4e:4a:57:60:5c:cd (4e:4a:57:60:5c:cd), Dst: FANUCROBOTIC_3f:bd:f4 (00:e0:e4:3f:bd:f4)
Internet Protocol Version 4, Src: 192.168.1.254, Dst: 192.168.1.2
Transmission Control Protocol, Src Port: 35796, Dst Port: 5001, Seq: 961, Ack: 1065, Len: 0

No.     Time           Source                Destination           Protocol Length Info
    131 7.558839       192.168.1.254         192.168.1.2           TCP      66     [TCP Port numbers reused] 60944 → 2222 [SYN] Seq=0 Win=64240 Len=0 MSS=1460 WS=256 SACK_PERM

Frame 131: 66 bytes on wire (528 bits), 66 bytes captured (528 bits)
Ethernet II, Src: 4e:4a:57:60:5c:cd (4e:4a:57:60:5c:cd), Dst: FANUCROBOTIC_3f:bd:f4 (00:e0:e4:3f:bd:f4)
Internet Protocol Version 4, Src: 192.168.1.254, Dst: 192.168.1.2
Transmission Control Protocol, Src Port: 60944, Dst Port: 2222, Seq: 0, Len: 0

No.     Time           Source                Destination           Protocol Length Info
    133 8.009991       192.168.1.254         192.168.1.2           TCP      94     45658 → 5001 [PSH, ACK] Seq=961 Ack=1065 Win=63870 Len=40

Frame 133: 94 bytes on wire (752 bits), 94 bytes captured (752 bits)
Ethernet II, Src: 4e:4a:57:60:5c:cd (4e:4a:57:60:5c:cd), Dst: FANUCROBOTIC_3f:bd:f4 (00:e0:e4:3f:bd:f4)
Internet Protocol Version 4, Src: 192.168.1.254, Dst: 192.168.1.2
Transmission Control Protocol, Src Port: 45658, Dst Port: 5001, Seq: 961, Ack: 1065, Len: 40
Data (40 bytes)

0000  a0 a0 a0 a0 00 01 21 01 00 1e 00 01 00 1c 00 02   ......!.........
0010  00 01 80 01 00 00 00 00 00 00 00 00 00 00 00 09   ................
0020  00 00 00 00 00 00 00 00                           ........
    Data: a0a0a0a000012101001e0001001c0002000180010000000000000000000000090000000000000000
    [Length: 40]

No.     Time           Source                Destination           Protocol Length Info
    136 8.019641       192.168.1.254         192.168.1.2           TCP      54     45658 → 5001 [ACK] Seq=1001 Ack=1094 Win=63870 Len=0

Frame 136: 54 bytes on wire (432 bits), 54 bytes captured (432 bits)
Ethernet II, Src: 4e:4a:57:60:5c:cd (4e:4a:57:60:5c:cd), Dst: FANUCROBOTIC_3f:bd:f4 (00:e0:e4:3f:bd:f4)
Internet Protocol Version 4, Src: 192.168.1.254, Dst: 192.168.1.2
Transmission Control Protocol, Src Port: 45658, Dst Port: 5001, Seq: 1001, Ack: 1094, Len: 0

No.     Time           Source                Destination           Protocol Length Info
    137 8.021273       192.168.1.254         192.168.1.2           TCP      94     45658 → 5001 [PSH, ACK] Seq=1001 Ack=1094 Win=63870 Len=40

Frame 137: 94 bytes on wire (752 bits), 94 bytes captured (752 bits)
Ethernet II, Src: 4e:4a:57:60:5c:cd (4e:4a:57:60:5c:cd), Dst: FANUCROBOTIC_3f:bd:f4 (00:e0:e4:3f:bd:f4)
Internet Protocol Version 4, Src: 192.168.1.254, Dst: 192.168.1.2
Transmission Control Protocol, Src Port: 45658, Dst Port: 5001, Seq: 1001, Ack: 1094, Len: 40
Data (40 bytes)

0000  a0 a0 a0 a0 00 01 21 01 00 1e 00 01 00 1c 00 01   ......!.........
0010  00 02 00 15 00 00 02 d0 00 00 02 d2 00 00 00 00   ................
0020  00 00 00 00 00 00 00 00                           ........
    Data: a0a0a0a000012101001e0001001c000100020015000002d0000002d2000000000000000000000000
    [Length: 40]

No.     Time           Source                Destination           Protocol Length Info
    139 8.041901       192.168.1.254         192.168.1.2           TCP      94     45658 → 5001 [PSH, ACK] Seq=1041 Ack=1146 Win=63870 Len=40

Frame 139: 94 bytes on wire (752 bits), 94 bytes captured (752 bits)
Ethernet II, Src: 4e:4a:57:60:5c:cd (4e:4a:57:60:5c:cd), Dst: FANUCROBOTIC_3f:bd:f4 (00:e0:e4:3f:bd:f4)
Internet Protocol Version 4, Src: 192.168.1.254, Dst: 192.168.1.2
Transmission Control Protocol, Src Port: 45658, Dst Port: 5001, Seq: 1041, Ack: 1146, Len: 40
Data (40 bytes)

0000  a0 a0 a0 a0 00 01 21 01 00 1e 00 01 00 1c 00 01   ......!.........
0010  00 01 00 15 00 00 02 d0 00 00 02 d2 00 00 00 00   ................
0020  00 00 00 00 00 00 00 00                           ........
    Data: a0a0a0a000012101001e0001001c000100010015000002d0000002d2000000000000000000000000
    [Length: 40]

No.     Time           Source                Destination           Protocol Length Info
    141 8.070531       192.168.1.254         192.168.1.2           TCP      66     [TCP Port numbers reused] 60944 → 2222 [SYN] Seq=0 Win=64240 Len=0 MSS=1460 WS=256 SACK_PERM

Frame 141: 66 bytes on wire (528 bits), 66 bytes captured (528 bits)
Ethernet II, Src: 4e:4a:57:60:5c:cd (4e:4a:57:60:5c:cd), Dst: FANUCROBOTIC_3f:bd:f4 (00:e0:e4:3f:bd:f4)
Internet Protocol Version 4, Src: 192.168.1.254, Dst: 192.168.1.2
Transmission Control Protocol, Src Port: 60944, Dst Port: 2222, Seq: 0, Len: 0

No.     Time           Source                Destination           Protocol Length Info
    143 8.111003       192.168.1.254         192.168.1.2           TCP      54     45658 → 5001 [ACK] Seq=1081 Ack=1198 Win=63870 Len=0

Frame 143: 54 bytes on wire (432 bits), 54 bytes captured (432 bits)
Ethernet II, Src: 4e:4a:57:60:5c:cd (4e:4a:57:60:5c:cd), Dst: FANUCROBOTIC_3f:bd:f4 (00:e0:e4:3f:bd:f4)
Internet Protocol Version 4, Src: 192.168.1.254, Dst: 192.168.1.2
Transmission Control Protocol, Src Port: 45658, Dst Port: 5001, Seq: 1081, Ack: 1198, Len: 0

No.     Time           Source                Destination           Protocol Length Info
    144 8.111978       192.168.1.254         192.168.1.2           TCP      94     35796 → 5001 [PSH, ACK] Seq=961 Ack=1065 Win=63870 Len=40

Frame 144: 94 bytes on wire (752 bits), 94 bytes captured (752 bits)
Ethernet II, Src: 4e:4a:57:60:5c:cd (4e:4a:57:60:5c:cd), Dst: FANUCROBOTIC_3f:bd:f4 (00:e0:e4:3f:bd:f4)
Internet Protocol Version 4, Src: 192.168.1.254, Dst: 192.168.1.2
Transmission Control Protocol, Src Port: 35796, Dst Port: 5001, Seq: 961, Ack: 1065, Len: 40
Data (40 bytes)

0000  a0 a0 a0 a0 00 01 21 01 00 1e 00 01 00 1c 00 02   ......!.........
0010  00 01 80 01 00 00 00 00 00 00 00 00 00 00 00 09   ................
0020  00 00 00 00 00 00 00 00                           ........
    Data: a0a0a0a000012101001e0001001c0002000180010000000000000000000000090000000000000000
    [Length: 40]

No.     Time           Source                Destination           Protocol Length Info
    146 8.139847       192.168.1.254         192.168.1.2           TCP      54     35796 → 5001 [ACK] Seq=1001 Ack=1094 Win=63870 Len=0

Frame 146: 54 bytes on wire (432 bits), 54 bytes captured (432 bits)
Ethernet II, Src: 4e:4a:57:60:5c:cd (4e:4a:57:60:5c:cd), Dst: FANUCROBOTIC_3f:bd:f4 (00:e0:e4:3f:bd:f4)
Internet Protocol Version 4, Src: 192.168.1.254, Dst: 192.168.1.2
Transmission Control Protocol, Src Port: 35796, Dst Port: 5001, Seq: 1001, Ack: 1094, Len: 0

No.     Time           Source                Destination           Protocol Length Info
    147 8.140363       192.168.1.254         192.168.1.2           TCP      94     35796 → 5001 [PSH, ACK] Seq=1001 Ack=1094 Win=63870 Len=40

Frame 147: 94 bytes on wire (752 bits), 94 bytes captured (752 bits)
Ethernet II, Src: 4e:4a:57:60:5c:cd (4e:4a:57:60:5c:cd), Dst: FANUCROBOTIC_3f:bd:f4 (00:e0:e4:3f:bd:f4)
Internet Protocol Version 4, Src: 192.168.1.254, Dst: 192.168.1.2
Transmission Control Protocol, Src Port: 35796, Dst Port: 5001, Seq: 1001, Ack: 1094, Len: 40
Data (40 bytes)

0000  a0 a0 a0 a0 00 01 21 01 00 1e 00 01 00 1c 00 01   ......!.........
0010  00 02 00 15 00 00 02 d0 00 00 02 d2 00 00 00 00   ................
0020  00 00 00 00 00 00 00 00                           ........
    Data: a0a0a0a000012101001e0001001c000100020015000002d0000002d2000000000000000000000000
    [Length: 40]

No.     Time           Source                Destination           Protocol Length Info
    149 8.167889       192.168.1.254         192.168.1.2           TCP      94     35796 → 5001 [PSH, ACK] Seq=1041 Ack=1146 Win=63870 Len=40

Frame 149: 94 bytes on wire (752 bits), 94 bytes captured (752 bits)
Ethernet II, Src: 4e:4a:57:60:5c:cd (4e:4a:57:60:5c:cd), Dst: FANUCROBOTIC_3f:bd:f4 (00:e0:e4:3f:bd:f4)
Internet Protocol Version 4, Src: 192.168.1.254, Dst: 192.168.1.2
Transmission Control Protocol, Src Port: 35796, Dst Port: 5001, Seq: 1041, Ack: 1146, Len: 40
Data (40 bytes)

0000  a0 a0 a0 a0 00 01 21 01 00 1e 00 01 00 1c 00 01   ......!.........
0010  00 01 00 15 00 00 02 d0 00 00 02 d2 00 00 00 00   ................
0020  00 00 00 00 00 00 00 00                           ........
    Data: a0a0a0a000012101001e0001001c000100010015000002d0000002d2000000000000000000000000
    [Length: 40]

No.     Time           Source                Destination           Protocol Length Info
    151 8.240393       192.168.1.254         192.168.1.2           TCP      54     35796 → 5001 [ACK] Seq=1081 Ack=1198 Win=63870 Len=0

Frame 151: 54 bytes on wire (432 bits), 54 bytes captured (432 bits)
Ethernet II, Src: 4e:4a:57:60:5c:cd (4e:4a:57:60:5c:cd), Dst: FANUCROBOTIC_3f:bd:f4 (00:e0:e4:3f:bd:f4)
Internet Protocol Version 4, Src: 192.168.1.254, Dst: 192.168.1.2
Transmission Control Protocol, Src Port: 35796, Dst Port: 5001, Seq: 1081, Ack: 1198, Len: 0

No.     Time           Source                Destination           Protocol Length Info
    152 8.582828       192.168.1.254         192.168.1.2           TCP      66     [TCP Port numbers reused] 60944 → 2222 [SYN] Seq=0 Win=64240 Len=0 MSS=1460 WS=256 SACK_PERM

Frame 152: 66 bytes on wire (528 bits), 66 bytes captured (528 bits)
Ethernet II, Src: 4e:4a:57:60:5c:cd (4e:4a:57:60:5c:cd), Dst: FANUCROBOTIC_3f:bd:f4 (00:e0:e4:3f:bd:f4)
Internet Protocol Version 4, Src: 192.168.1.254, Dst: 192.168.1.2
Transmission Control Protocol, Src Port: 60944, Dst Port: 2222, Seq: 0, Len: 0

No.     Time           Source                Destination           Protocol Length Info
    155 9.010493       192.168.1.254         192.168.1.2           TCP      94     45658 → 5001 [PSH, ACK] Seq=1081 Ack=1198 Win=63870 Len=40

Frame 155: 94 bytes on wire (752 bits), 94 bytes captured (752 bits)
Ethernet II, Src: 4e:4a:57:60:5c:cd (4e:4a:57:60:5c:cd), Dst: FANUCROBOTIC_3f:bd:f4 (00:e0:e4:3f:bd:f4)
Internet Protocol Version 4, Src: 192.168.1.254, Dst: 192.168.1.2
Transmission Control Protocol, Src Port: 45658, Dst Port: 5001, Seq: 1081, Ack: 1198, Len: 40
Data (40 bytes)

0000  a0 a0 a0 a0 00 01 21 01 00 1e 00 01 00 1c 00 02   ......!.........
0010  00 01 80 01 00 00 00 00 00 00 00 00 00 00 00 09   ................
0020  00 00 00 00 00 00 00 00                           ........
    Data: a0a0a0a000012101001e0001001c0002000180010000000000000000000000090000000000000000
    [Length: 40]

No.     Time           Source                Destination           Protocol Length Info
    157 9.046627       192.168.1.254         192.168.1.2           TCP      54     45658 → 5001 [ACK] Seq=1121 Ack=1227 Win=63870 Len=0

Frame 157: 54 bytes on wire (432 bits), 54 bytes captured (432 bits)
Ethernet II, Src: 4e:4a:57:60:5c:cd (4e:4a:57:60:5c:cd), Dst: FANUCROBOTIC_3f:bd:f4 (00:e0:e4:3f:bd:f4)
Internet Protocol Version 4, Src: 192.168.1.254, Dst: 192.168.1.2
Transmission Control Protocol, Src Port: 45658, Dst Port: 5001, Seq: 1121, Ack: 1227, Len: 0

No.     Time           Source                Destination           Protocol Length Info
    158 9.048721       192.168.1.254         192.168.1.2           TCP      94     45658 → 5001 [PSH, ACK] Seq=1121 Ack=1227 Win=63870 Len=40

Frame 158: 94 bytes on wire (752 bits), 94 bytes captured (752 bits)
Ethernet II, Src: 4e:4a:57:60:5c:cd (4e:4a:57:60:5c:cd), Dst: FANUCROBOTIC_3f:bd:f4 (00:e0:e4:3f:bd:f4)
Internet Protocol Version 4, Src: 192.168.1.254, Dst: 192.168.1.2
Transmission Control Protocol, Src Port: 45658, Dst Port: 5001, Seq: 1121, Ack: 1227, Len: 40
Data (40 bytes)

0000  a0 a0 a0 a0 00 01 21 01 00 1e 00 01 00 1c 00 01   ......!.........
0010  00 02 00 15 00 00 02 d0 00 00 02 d2 00 00 00 00   ................
0020  00 00 00 00 00 00 00 00                           ........
    Data: a0a0a0a000012101001e0001001c000100020015000002d0000002d2000000000000000000000000
    [Length: 40]

No.     Time           Source                Destination           Protocol Length Info
    160 9.086672       192.168.1.254         192.168.1.2           TCP      94     45658 → 5001 [PSH, ACK] Seq=1161 Ack=1279 Win=63870 Len=40

Frame 160: 94 bytes on wire (752 bits), 94 bytes captured (752 bits)
Ethernet II, Src: 4e:4a:57:60:5c:cd (4e:4a:57:60:5c:cd), Dst: FANUCROBOTIC_3f:bd:f4 (00:e0:e4:3f:bd:f4)
Internet Protocol Version 4, Src: 192.168.1.254, Dst: 192.168.1.2
Transmission Control Protocol, Src Port: 45658, Dst Port: 5001, Seq: 1161, Ack: 1279, Len: 40
Data (40 bytes)

0000  a0 a0 a0 a0 00 01 21 01 00 1e 00 01 00 1c 00 01   ......!.........
0010  00 01 00 15 00 00 02 d0 00 00 02 d2 00 00 00 00   ................
0020  00 00 00 00 00 00 00 00                           ........
    Data: a0a0a0a000012101001e0001001c000100010015000002d0000002d2000000000000000000000000
    [Length: 40]

No.     Time           Source                Destination           Protocol Length Info
    161 9.098884       192.168.1.254         192.168.1.2           TCP      66     [TCP Port numbers reused] 60944 → 2222 [SYN] Seq=0 Win=64240 Len=0 MSS=1460 WS=256 SACK_PERM

Frame 161: 66 bytes on wire (528 bits), 66 bytes captured (528 bits)
Ethernet II, Src: 4e:4a:57:60:5c:cd (4e:4a:57:60:5c:cd), Dst: FANUCROBOTIC_3f:bd:f4 (00:e0:e4:3f:bd:f4)
Internet Protocol Version 4, Src: 192.168.1.254, Dst: 192.168.1.2
Transmission Control Protocol, Src Port: 60944, Dst Port: 2222, Seq: 0, Len: 0

No.     Time           Source                Destination           Protocol Length Info
    164 9.113090       192.168.1.254         192.168.1.2           TCP      94     35796 → 5001 [PSH, ACK] Seq=1081 Ack=1198 Win=63870 Len=40

Frame 164: 94 bytes on wire (752 bits), 94 bytes captured (752 bits)
Ethernet II, Src: 4e:4a:57:60:5c:cd (4e:4a:57:60:5c:cd), Dst: FANUCROBOTIC_3f:bd:f4 (00:e0:e4:3f:bd:f4)
Internet Protocol Version 4, Src: 192.168.1.254, Dst: 192.168.1.2
Transmission Control Protocol, Src Port: 35796, Dst Port: 5001, Seq: 1081, Ack: 1198, Len: 40
Data (40 bytes)

0000  a0 a0 a0 a0 00 01 21 01 00 1e 00 01 00 1c 00 02   ......!.........
0010  00 01 80 01 00 00 00 00 00 00 00 00 00 00 00 09   ................
0020  00 00 00 00 00 00 00 00                           ........
    Data: a0a0a0a000012101001e0001001c0002000180010000000000000000000000090000000000000000
    [Length: 40]

No.     Time           Source                Destination           Protocol Length Info
    166 9.126958       192.168.1.254         192.168.1.2           TCP      54     35796 → 5001 [ACK] Seq=1121 Ack=1227 Win=63870 Len=0

Frame 166: 54 bytes on wire (432 bits), 54 bytes captured (432 bits)
Ethernet II, Src: 4e:4a:57:60:5c:cd (4e:4a:57:60:5c:cd), Dst: FANUCROBOTIC_3f:bd:f4 (00:e0:e4:3f:bd:f4)
Internet Protocol Version 4, Src: 192.168.1.254, Dst: 192.168.1.2
Transmission Control Protocol, Src Port: 35796, Dst Port: 5001, Seq: 1121, Ack: 1227, Len: 0

No.     Time           Source                Destination           Protocol Length Info
    167 9.127592       192.168.1.254         192.168.1.2           TCP      94     35796 → 5001 [PSH, ACK] Seq=1121 Ack=1227 Win=63870 Len=40

Frame 167: 94 bytes on wire (752 bits), 94 bytes captured (752 bits)
Ethernet II, Src: 4e:4a:57:60:5c:cd (4e:4a:57:60:5c:cd), Dst: FANUCROBOTIC_3f:bd:f4 (00:e0:e4:3f:bd:f4)
Internet Protocol Version 4, Src: 192.168.1.254, Dst: 192.168.1.2
Transmission Control Protocol, Src Port: 35796, Dst Port: 5001, Seq: 1121, Ack: 1227, Len: 40
Data (40 bytes)

0000  a0 a0 a0 a0 00 01 21 01 00 1e 00 01 00 1c 00 01   ......!.........
0010  00 02 00 15 00 00 02 d0 00 00 02 d2 00 00 00 00   ................
0020  00 00 00 00 00 00 00 00                           ........
    Data: a0a0a0a000012101001e0001001c000100020015000002d0000002d2000000000000000000000000
    [Length: 40]

No.     Time           Source                Destination           Protocol Length Info
    168 9.148050       192.168.1.254         192.168.1.2           TCP      54     45658 → 5001 [ACK] Seq=1201 Ack=1331 Win=63870 Len=0

Frame 168: 54 bytes on wire (432 bits), 54 bytes captured (432 bits)
Ethernet II, Src: 4e:4a:57:60:5c:cd (4e:4a:57:60:5c:cd), Dst: FANUCROBOTIC_3f:bd:f4 (00:e0:e4:3f:bd:f4)
Internet Protocol Version 4, Src: 192.168.1.254, Dst: 192.168.1.2
Transmission Control Protocol, Src Port: 45658, Dst Port: 5001, Seq: 1201, Ack: 1331, Len: 0

No.     Time           Source                Destination           Protocol Length Info
    170 9.160064       192.168.1.254         192.168.1.2           TCP      94     35796 → 5001 [PSH, ACK] Seq=1161 Ack=1279 Win=63870 Len=40

Frame 170: 94 bytes on wire (752 bits), 94 bytes captured (752 bits)
Ethernet II, Src: 4e:4a:57:60:5c:cd (4e:4a:57:60:5c:cd), Dst: FANUCROBOTIC_3f:bd:f4 (00:e0:e4:3f:bd:f4)
Internet Protocol Version 4, Src: 192.168.1.254, Dst: 192.168.1.2
Transmission Control Protocol, Src Port: 35796, Dst Port: 5001, Seq: 1161, Ack: 1279, Len: 40
Data (40 bytes)

0000  a0 a0 a0 a0 00 01 21 01 00 1e 00 01 00 1c 00 01   ......!.........
0010  00 01 00 15 00 00 02 d0 00 00 02 d2 00 00 00 00   ................
0020  00 00 00 00 00 00 00 00                           ........
    Data: a0a0a0a000012101001e0001001c000100010015000002d0000002d2000000000000000000000000
    [Length: 40]

No.     Time           Source                Destination           Protocol Length Info
    172 9.231400       192.168.1.254         192.168.1.2           TCP      54     35796 → 5001 [ACK] Seq=1201 Ack=1331 Win=63870 Len=0

Frame 172: 54 bytes on wire (432 bits), 54 bytes captured (432 bits)
Ethernet II, Src: 4e:4a:57:60:5c:cd (4e:4a:57:60:5c:cd), Dst: FANUCROBOTIC_3f:bd:f4 (00:e0:e4:3f:bd:f4)
Internet Protocol Version 4, Src: 192.168.1.254, Dst: 192.168.1.2
Transmission Control Protocol, Src Port: 35796, Dst Port: 5001, Seq: 1201, Ack: 1331, Len: 0

No.     Time           Source                Destination           Protocol Length Info
    174 10.012098      192.168.1.254         192.168.1.2           TCP      94     45658 → 5001 [PSH, ACK] Seq=1201 Ack=1331 Win=63870 Len=40

Frame 174: 94 bytes on wire (752 bits), 94 bytes captured (752 bits)
Ethernet II, Src: 4e:4a:57:60:5c:cd (4e:4a:57:60:5c:cd), Dst: FANUCROBOTIC_3f:bd:f4 (00:e0:e4:3f:bd:f4)
Internet Protocol Version 4, Src: 192.168.1.254, Dst: 192.168.1.2
Transmission Control Protocol, Src Port: 45658, Dst Port: 5001, Seq: 1201, Ack: 1331, Len: 40
Data (40 bytes)

0000  a0 a0 a0 a0 00 01 21 01 00 1e 00 01 00 1c 00 02   ......!.........
0010  00 01 80 01 00 00 00 00 00 00 00 00 00 00 00 09   ................
0020  00 00 00 00 00 00 00 00                           ........
    Data: a0a0a0a000012101001e0001001c0002000180010000000000000000000000090000000000000000
    [Length: 40]

No.     Time           Source                Destination           Protocol Length Info
    176 10.063239      192.168.1.254         192.168.1.2           TCP      54     45658 → 5001 [ACK] Seq=1241 Ack=1360 Win=63870 Len=0

Frame 176: 54 bytes on wire (432 bits), 54 bytes captured (432 bits)
Ethernet II, Src: 4e:4a:57:60:5c:cd (4e:4a:57:60:5c:cd), Dst: FANUCROBOTIC_3f:bd:f4 (00:e0:e4:3f:bd:f4)
Internet Protocol Version 4, Src: 192.168.1.254, Dst: 192.168.1.2
Transmission Control Protocol, Src Port: 45658, Dst Port: 5001, Seq: 1241, Ack: 1360, Len: 0

No.     Time           Source                Destination           Protocol Length Info
    177 10.064909      192.168.1.254         192.168.1.2           TCP      94     45658 → 5001 [PSH, ACK] Seq=1241 Ack=1360 Win=63870 Len=40

Frame 177: 94 bytes on wire (752 bits), 94 bytes captured (752 bits)
Ethernet II, Src: 4e:4a:57:60:5c:cd (4e:4a:57:60:5c:cd), Dst: FANUCROBOTIC_3f:bd:f4 (00:e0:e4:3f:bd:f4)
Internet Protocol Version 4, Src: 192.168.1.254, Dst: 192.168.1.2
Transmission Control Protocol, Src Port: 45658, Dst Port: 5001, Seq: 1241, Ack: 1360, Len: 40
Data (40 bytes)

0000  a0 a0 a0 a0 00 01 21 01 00 1e 00 01 00 1c 00 01   ......!.........
0010  00 02 00 15 00 00 02 d0 00 00 02 d2 00 00 00 00   ................
0020  00 00 00 00 00 00 00 00                           ........
    Data: a0a0a0a000012101001e0001001c000100020015000002d0000002d2000000000000000000000000
    [Length: 40]

No.     Time           Source                Destination           Protocol Length Info
    179 10.089973      192.168.1.254         192.168.1.2           TCP      94     45658 → 5001 [PSH, ACK] Seq=1281 Ack=1412 Win=63870 Len=40

Frame 179: 94 bytes on wire (752 bits), 94 bytes captured (752 bits)
Ethernet II, Src: 4e:4a:57:60:5c:cd (4e:4a:57:60:5c:cd), Dst: FANUCROBOTIC_3f:bd:f4 (00:e0:e4:3f:bd:f4)
Internet Protocol Version 4, Src: 192.168.1.254, Dst: 192.168.1.2
Transmission Control Protocol, Src Port: 45658, Dst Port: 5001, Seq: 1281, Ack: 1412, Len: 40
Data (40 bytes)

0000  a0 a0 a0 a0 00 01 21 01 00 1e 00 01 00 1c 00 01   ......!.........
0010  00 01 00 15 00 00 02 d0 00 00 02 d2 00 00 00 00   ................
0020  00 00 00 00 00 00 00 00                           ........
    Data: a0a0a0a000012101001e0001001c000100010015000002d0000002d2000000000000000000000000
    [Length: 40]

No.     Time           Source                Destination           Protocol Length Info
    181 10.113651      192.168.1.254         192.168.1.2           TCP      94     35796 → 5001 [PSH, ACK] Seq=1201 Ack=1331 Win=63870 Len=40

Frame 181: 94 bytes on wire (752 bits), 94 bytes captured (752 bits)
Ethernet II, Src: 4e:4a:57:60:5c:cd (4e:4a:57:60:5c:cd), Dst: FANUCROBOTIC_3f:bd:f4 (00:e0:e4:3f:bd:f4)
Internet Protocol Version 4, Src: 192.168.1.254, Dst: 192.168.1.2
Transmission Control Protocol, Src Port: 35796, Dst Port: 5001, Seq: 1201, Ack: 1331, Len: 40
Data (40 bytes)

0000  a0 a0 a0 a0 00 01 21 01 00 1e 00 01 00 1c 00 02   ......!.........
0010  00 01 80 01 00 00 00 00 00 00 00 00 00 00 00 09   ................
0020  00 00 00 00 00 00 00 00                           ........
    Data: a0a0a0a000012101001e0001001c0002000180010000000000000000000000090000000000000000
    [Length: 40]

No.     Time           Source                Destination           Protocol Length Info
    183 10.134908      192.168.1.254         192.168.1.2           TCP      54     35796 → 5001 [ACK] Seq=1241 Ack=1360 Win=63870 Len=0

Frame 183: 54 bytes on wire (432 bits), 54 bytes captured (432 bits)
Ethernet II, Src: 4e:4a:57:60:5c:cd (4e:4a:57:60:5c:cd), Dst: FANUCROBOTIC_3f:bd:f4 (00:e0:e4:3f:bd:f4)
Internet Protocol Version 4, Src: 192.168.1.254, Dst: 192.168.1.2
Transmission Control Protocol, Src Port: 35796, Dst Port: 5001, Seq: 1241, Ack: 1360, Len: 0

No.     Time           Source                Destination           Protocol Length Info
    184 10.135550      192.168.1.254         192.168.1.2           TCP      94     35796 → 5001 [PSH, ACK] Seq=1241 Ack=1360 Win=63870 Len=40

Frame 184: 94 bytes on wire (752 bits), 94 bytes captured (752 bits)
Ethernet II, Src: 4e:4a:57:60:5c:cd (4e:4a:57:60:5c:cd), Dst: FANUCROBOTIC_3f:bd:f4 (00:e0:e4:3f:bd:f4)
Internet Protocol Version 4, Src: 192.168.1.254, Dst: 192.168.1.2
Transmission Control Protocol, Src Port: 35796, Dst Port: 5001, Seq: 1241, Ack: 1360, Len: 40
Data (40 bytes)

0000  a0 a0 a0 a0 00 01 21 01 00 1e 00 01 00 1c 00 01   ......!.........
0010  00 02 00 15 00 00 02 d0 00 00 02 d2 00 00 00 00   ................
0020  00 00 00 00 00 00 00 00                           ........
    Data: a0a0a0a000012101001e0001001c000100020015000002d0000002d2000000000000000000000000
    [Length: 40]

No.     Time           Source                Destination           Protocol Length Info
    185 10.142981      192.168.1.254         192.168.1.2           TCP      54     45658 → 5001 [ACK] Seq=1321 Ack=1464 Win=63870 Len=0

Frame 185: 54 bytes on wire (432 bits), 54 bytes captured (432 bits)
Ethernet II, Src: 4e:4a:57:60:5c:cd (4e:4a:57:60:5c:cd), Dst: FANUCROBOTIC_3f:bd:f4 (00:e0:e4:3f:bd:f4)
Internet Protocol Version 4, Src: 192.168.1.254, Dst: 192.168.1.2
Transmission Control Protocol, Src Port: 45658, Dst Port: 5001, Seq: 1321, Ack: 1464, Len: 0

No.     Time           Source                Destination           Protocol Length Info
    187 10.164812      192.168.1.254         192.168.1.2           TCP      94     35796 → 5001 [PSH, ACK] Seq=1281 Ack=1412 Win=63870 Len=40

Frame 187: 94 bytes on wire (752 bits), 94 bytes captured (752 bits)
Ethernet II, Src: 4e:4a:57:60:5c:cd (4e:4a:57:60:5c:cd), Dst: FANUCROBOTIC_3f:bd:f4 (00:e0:e4:3f:bd:f4)
Internet Protocol Version 4, Src: 192.168.1.254, Dst: 192.168.1.2
Transmission Control Protocol, Src Port: 35796, Dst Port: 5001, Seq: 1281, Ack: 1412, Len: 40
Data (40 bytes)

0000  a0 a0 a0 a0 00 01 21 01 00 1e 00 01 00 1c 00 01   ......!.........
0010  00 01 00 15 00 00 02 d0 00 00 02 d2 00 00 00 00   ................
0020  00 00 00 00 00 00 00 00                           ........
    Data: a0a0a0a000012101001e0001001c000100010015000002d0000002d2000000000000000000000000
    [Length: 40]

No.     Time           Source                Destination           Protocol Length Info
    189 10.223420      192.168.1.254         192.168.1.2           TCP      54     35796 → 5001 [ACK] Seq=1321 Ack=1464 Win=63870 Len=0

Frame 189: 54 bytes on wire (432 bits), 54 bytes captured (432 bits)
Ethernet II, Src: 4e:4a:57:60:5c:cd (4e:4a:57:60:5c:cd), Dst: FANUCROBOTIC_3f:bd:f4 (00:e0:e4:3f:bd:f4)
Internet Protocol Version 4, Src: 192.168.1.254, Dst: 192.168.1.2
Transmission Control Protocol, Src Port: 35796, Dst Port: 5001, Seq: 1321, Ack: 1464, Len: 0

No.     Time           Source                Destination           Protocol Length Info
    192 11.012422      192.168.1.254         192.168.1.2           TCP      94     45658 → 5001 [PSH, ACK] Seq=1321 Ack=1464 Win=63870 Len=40

Frame 192: 94 bytes on wire (752 bits), 94 bytes captured (752 bits)
Ethernet II, Src: 4e:4a:57:60:5c:cd (4e:4a:57:60:5c:cd), Dst: FANUCROBOTIC_3f:bd:f4 (00:e0:e4:3f:bd:f4)
Internet Protocol Version 4, Src: 192.168.1.254, Dst: 192.168.1.2
Transmission Control Protocol, Src Port: 45658, Dst Port: 5001, Seq: 1321, Ack: 1464, Len: 40
Data (40 bytes)

0000  a0 a0 a0 a0 00 01 21 01 00 1e 00 01 00 1c 00 02   ......!.........
0010  00 01 80 01 00 00 00 00 00 00 00 00 00 00 00 09   ................
0020  00 00 00 00 00 00 00 00                           ........
    Data: a0a0a0a000012101001e0001001c0002000180010000000000000000000000090000000000000000
    [Length: 40]

No.     Time           Source                Destination           Protocol Length Info
    194 11.027965      192.168.1.254         192.168.1.2           TCP      54     45658 → 5001 [ACK] Seq=1361 Ack=1493 Win=63870 Len=0

Frame 194: 54 bytes on wire (432 bits), 54 bytes captured (432 bits)
Ethernet II, Src: 4e:4a:57:60:5c:cd (4e:4a:57:60:5c:cd), Dst: FANUCROBOTIC_3f:bd:f4 (00:e0:e4:3f:bd:f4)
Internet Protocol Version 4, Src: 192.168.1.254, Dst: 192.168.1.2
Transmission Control Protocol, Src Port: 45658, Dst Port: 5001, Seq: 1361, Ack: 1493, Len: 0

No.     Time           Source                Destination           Protocol Length Info
    195 11.029514      192.168.1.254         192.168.1.2           TCP      94     45658 → 5001 [PSH, ACK] Seq=1361 Ack=1493 Win=63870 Len=40

Frame 195: 94 bytes on wire (752 bits), 94 bytes captured (752 bits)
Ethernet II, Src: 4e:4a:57:60:5c:cd (4e:4a:57:60:5c:cd), Dst: FANUCROBOTIC_3f:bd:f4 (00:e0:e4:3f:bd:f4)
Internet Protocol Version 4, Src: 192.168.1.254, Dst: 192.168.1.2
Transmission Control Protocol, Src Port: 45658, Dst Port: 5001, Seq: 1361, Ack: 1493, Len: 40
Data (40 bytes)

0000  a0 a0 a0 a0 00 01 21 01 00 1e 00 01 00 1c 00 01   ......!.........
0010  00 02 00 15 00 00 02 d0 00 00 02 d2 00 00 00 00   ................
0020  00 00 00 00 00 00 00 00                           ........
    Data: a0a0a0a000012101001e0001001c000100020015000002d0000002d2000000000000000000000000
    [Length: 40]

No.     Time           Source                Destination           Protocol Length Info
    197 11.049881      192.168.1.254         192.168.1.2           TCP      94     45658 → 5001 [PSH, ACK] Seq=1401 Ack=1545 Win=63870 Len=40

Frame 197: 94 bytes on wire (752 bits), 94 bytes captured (752 bits)
Ethernet II, Src: 4e:4a:57:60:5c:cd (4e:4a:57:60:5c:cd), Dst: FANUCROBOTIC_3f:bd:f4 (00:e0:e4:3f:bd:f4)
Internet Protocol Version 4, Src: 192.168.1.254, Dst: 192.168.1.2
Transmission Control Protocol, Src Port: 45658, Dst Port: 5001, Seq: 1401, Ack: 1545, Len: 40
Data (40 bytes)

0000  a0 a0 a0 a0 00 01 21 01 00 1e 00 01 00 1c 00 01   ......!.........
0010  00 01 00 15 00 00 02 d0 00 00 02 d2 00 00 00 00   ................
0020  00 00 00 00 00 00 00 00                           ........
    Data: a0a0a0a000012101001e0001001c000100010015000002d0000002d2000000000000000000000000
    [Length: 40]

No.     Time           Source                Destination           Protocol Length Info
    199 11.102997      192.168.1.254         192.168.1.2           TCP      54     45658 → 5001 [ACK] Seq=1441 Ack=1597 Win=63870 Len=0

Frame 199: 54 bytes on wire (432 bits), 54 bytes captured (432 bits)
Ethernet II, Src: 4e:4a:57:60:5c:cd (4e:4a:57:60:5c:cd), Dst: FANUCROBOTIC_3f:bd:f4 (00:e0:e4:3f:bd:f4)
Internet Protocol Version 4, Src: 192.168.1.254, Dst: 192.168.1.2
Transmission Control Protocol, Src Port: 45658, Dst Port: 5001, Seq: 1441, Ack: 1597, Len: 0

No.     Time           Source                Destination           Protocol Length Info
    200 11.115013      192.168.1.254         192.168.1.2           TCP      94     35796 → 5001 [PSH, ACK] Seq=1321 Ack=1464 Win=63870 Len=40

Frame 200: 94 bytes on wire (752 bits), 94 bytes captured (752 bits)
Ethernet II, Src: 4e:4a:57:60:5c:cd (4e:4a:57:60:5c:cd), Dst: FANUCROBOTIC_3f:bd:f4 (00:e0:e4:3f:bd:f4)
Internet Protocol Version 4, Src: 192.168.1.254, Dst: 192.168.1.2
Transmission Control Protocol, Src Port: 35796, Dst Port: 5001, Seq: 1321, Ack: 1464, Len: 40
Data (40 bytes)

0000  a0 a0 a0 a0 00 01 21 01 00 1e 00 01 00 1c 00 02   ......!.........
0010  00 01 80 01 00 00 00 00 00 00 00 00 00 00 00 09   ................
0020  00 00 00 00 00 00 00 00                           ........
    Data: a0a0a0a000012101001e0001001c0002000180010000000000000000000000090000000000000000
    [Length: 40]

No.     Time           Source                Destination           Protocol Length Info
    202 11.126972      192.168.1.254         192.168.1.2           TCP      54     35796 → 5001 [ACK] Seq=1361 Ack=1493 Win=63870 Len=0

Frame 202: 54 bytes on wire (432 bits), 54 bytes captured (432 bits)
Ethernet II, Src: 4e:4a:57:60:5c:cd (4e:4a:57:60:5c:cd), Dst: FANUCROBOTIC_3f:bd:f4 (00:e0:e4:3f:bd:f4)
Internet Protocol Version 4, Src: 192.168.1.254, Dst: 192.168.1.2
Transmission Control Protocol, Src Port: 35796, Dst Port: 5001, Seq: 1361, Ack: 1493, Len: 0

No.     Time           Source                Destination           Protocol Length Info
    203 11.127598      192.168.1.254         192.168.1.2           TCP      94     35796 → 5001 [PSH, ACK] Seq=1361 Ack=1493 Win=63870 Len=40

Frame 203: 94 bytes on wire (752 bits), 94 bytes captured (752 bits)
Ethernet II, Src: 4e:4a:57:60:5c:cd (4e:4a:57:60:5c:cd), Dst: FANUCROBOTIC_3f:bd:f4 (00:e0:e4:3f:bd:f4)
Internet Protocol Version 4, Src: 192.168.1.254, Dst: 192.168.1.2
Transmission Control Protocol, Src Port: 35796, Dst Port: 5001, Seq: 1361, Ack: 1493, Len: 40
Data (40 bytes)

0000  a0 a0 a0 a0 00 01 21 01 00 1e 00 01 00 1c 00 01   ......!.........
0010  00 02 00 15 00 00 02 d0 00 00 02 d2 00 00 00 00   ................
0020  00 00 00 00 00 00 00 00                           ........
    Data: a0a0a0a000012101001e0001001c000100020015000002d0000002d2000000000000000000000000
    [Length: 40]

No.     Time           Source                Destination           Protocol Length Info
    205 11.156598      192.168.1.254         192.168.1.2           TCP      94     35796 → 5001 [PSH, ACK] Seq=1401 Ack=1545 Win=63870 Len=40

Frame 205: 94 bytes on wire (752 bits), 94 bytes captured (752 bits)
Ethernet II, Src: 4e:4a:57:60:5c:cd (4e:4a:57:60:5c:cd), Dst: FANUCROBOTIC_3f:bd:f4 (00:e0:e4:3f:bd:f4)
Internet Protocol Version 4, Src: 192.168.1.254, Dst: 192.168.1.2
Transmission Control Protocol, Src Port: 35796, Dst Port: 5001, Seq: 1401, Ack: 1545, Len: 40
Data (40 bytes)

0000  a0 a0 a0 a0 00 01 21 01 00 1e 00 01 00 1c 00 01   ......!.........
0010  00 01 00 15 00 00 02 d0 00 00 02 d2 00 00 00 00   ................
0020  00 00 00 00 00 00 00 00                           ........
    Data: a0a0a0a000012101001e0001001c000100010015000002d0000002d2000000000000000000000000
    [Length: 40]

No.     Time           Source                Destination           Protocol Length Info
    207 11.215438      192.168.1.254         192.168.1.2           TCP      54     35796 → 5001 [ACK] Seq=1441 Ack=1597 Win=63870 Len=0

Frame 207: 54 bytes on wire (432 bits), 54 bytes captured (432 bits)
Ethernet II, Src: 4e:4a:57:60:5c:cd (4e:4a:57:60:5c:cd), Dst: FANUCROBOTIC_3f:bd:f4 (00:e0:e4:3f:bd:f4)
Internet Protocol Version 4, Src: 192.168.1.254, Dst: 192.168.1.2
Transmission Control Protocol, Src Port: 35796, Dst Port: 5001, Seq: 1441, Ack: 1597, Len: 0
